isbn,title,publisher,published_date,publisher_desription,n_pages,category,mean_rating,num_ratings,sale_country,access_country,cover_thumbnail_url,preview_url,title_us
9.78E+12,Horton Hears a Who,HarperCollins UK,12/1/17,"The timeless classic from the iconic Dr. Seuss _æ_ now available in ebook, with read-along narration performed by Miranda Richardson. Enjoy this classic tale of a big-hearted elephant anytime, anywhere!",64,Juvenile Fiction,4,5,US,US,http://books.google.com/books/content?id=3fY9DwAAQBAJ&printsec=frontcover&img=1&zoom=1&source=gbs_api,http://books.google.com/books?id=3fY9DwAAQBAJ&dq=isbn:9780008202446&hl=&cd=1&source=gbs_api,horton hears a who!
9.78E+12,If You Give a Moose a Muffin,Harper Collins,9/30/91,"If a big hungry moose comes to visit, you might give him a muffin to make him feel at home. If you give him a muffin, he'll want some jam to go with it. When he's eaten all your muffins, he'll want to go to the store to get some more muffin mix. In this hilarious sequel to If You Give a Mouse a Cookie, the young host is again run ragged by a surprise guest. Young readers will delight in the comic complications that follow when a little boy entertains a gregarious moose.",32,Juvenile Fiction,4,51,US,US,http://books.google.com/books/content?id=qfTVeqUU3awC&printsec=frontcover&img=1&zoom=1&edge=curl&source=gbs_api,http://books.google.com/books?id=qfTVeqUU3awC&printsec=frontcover&dq=isbn:9780060244057&hl=&cd=1&source=gbs_api,if you give a moose a muffin
9.78E+12,I'm a Big Sister,Harper Collins,3/25/14,"With an author's note about what big siblings need_æ”extra guidance, reassurance, love_æ”and sweet, engaging artwork, it's no wonder that nearly 4 million families have chosen I_æ_m a Big Sister and its companion book, I_æ_m a Big Brother, to prepare their young ones for their first big transition. ""Someone new is at our house,"" begins this loving, reassuring celebration of brotherhood from trusted author Joanna Cole. Told through the eyes of a new older sister, this simple story lays out all the good things about being an older sibling, and just how exciting welcoming a new member to the family can be.",32,Juvenile Fiction,4,16,US,US,http://books.google.com/books/content?id=v3p0AgAAQBAJ&printsec=frontcover&img=1&zoom=1&edge=curl&source=gbs_api,http://books.google.com/books?id=v3p0AgAAQBAJ&printsec=frontcover&dq=isbn:9780062347138&hl=&cd=1&source=gbs_api,i'm a big sister
9.78E+12,Where's Spot?,Penguin Books Limited,1/3/13,A mother dog finds eight other animals hiding around the house before finding her lost puppy. Movable flaps conceal portions of the illustrations and text.,22,Animals,NA,NA,US,US,http://books.google.com/books/content?id=Cr1kMQEACAAJ&printsec=frontcover&img=1&zoom=1&source=gbs_api,http://books.google.com/books?id=Cr1kMQEACAAJ&dq=isbn:9780141343747&hl=&cd=1&source=gbs_api,where's spot?
9.78E+12,Little Blue Truck Leads the Way,Houghton Mifflin Harcourt,2009,"A country truck feels out of place in the speedy, noisy city until he comes to the rescue during a giant traffic jam.",40,Juvenile Fiction,3.5,4,US,US,http://books.google.com/books/content?id=lkuRQ_Qrub8C&printsec=frontcover&img=1&zoom=1&edge=curl&source=gbs_api,http://books.google.com/books?id=lkuRQ_Qrub8C&printsec=frontcover&dq=isbn:9780152063894&hl=&cd=1&source=gbs_api,little blue truck leads the way
9.78E+12,I Am a Bunny,Golden Books,8/31/11,"I am a bunny. My name is Nicholas. I live in a hollow tree. In the spring, Nicholas likes to sniff the flowers, and in the summer, watch the frogs in the pond. In the fall, he watches the animals getting ready for winter, and in winter, watches the snow falling from the sky. One of Golden's most beloved titles, this beautifully illustrated, gentle story is now available as an eBook.",26,Juvenile Fiction,5,1,US,US,http://books.google.com/books/content?id=b1m3WXcqRnYC&printsec=frontcover&img=1&zoom=1&edge=curl&source=gbs_api,http://books.google.com/books?id=b1m3WXcqRnYC&printsec=frontcover&dq=isbn:9780307974679&hl=&cd=1&source=gbs_api,i am a bunny
9.78E+12,Big Board First 100 Words,Macmillan,8/1/05,"Presents pictures of individually labeled items that are grouped into sections based on what they are, such as things that go, pets, and food.",16,Juvenile Nonfiction,5,3,US,US,http://books.google.com/books/content?id=8_BfAwAAQBAJ&printsec=frontcover&img=1&zoom=1&edge=curl&source=gbs_api,http://books.google.com/books?id=8_BfAwAAQBAJ&printsec=frontcover&dq=isbn:9780312495411&hl=&cd=1&source=gbs_api,first 100 words
9.78E+12,"If You Ever Want to Bring a Piano to the Beach, Don't!","Little, Brown Books for Young Readers",5/3/16,"Elise Parsley's tale of the charismatic and willful Magnolia's disastrous trip to the beach follows up her New York Times bestselling debut, If You Ever Want to Bring an Alligator to School, Don't! If your mom says to get ready to play at the beach, she means with a boat, or a Frisbee, or a shovel. She is NOT talking about the piano. But Magnolia is a little girl with a big idea, determination, and one very heavy upright piano that, she insists, she needs to take with her. What's the worst that can happen? In a riotous series of mishaps, Magnolia quickly learns that--not surprisingly--a piano doesn't mix well with sand, sun, and seagulls!",40,Juvenile Fiction,3.5,31,US,US,http://books.google.com/books/content?id=OomDCgAAQBAJ&printsec=frontcover&img=1&zoom=1&edge=curl&source=gbs_api,http://books.google.com/books?id=OomDCgAAQBAJ&printsec=frontcover&dq=isbn:9780316271028&hl=&cd=1&source=gbs_api,"if you ever want to bring a piano to the beach, don't!"
9.78E+12,If Animals Kissed Good Night,Macmillan,6/3/14,"Rhyming text explores what would happen if animals kissed like humans do, from a slow kiss between a sloth and her cub to a mud-happy kiss from a hippo calf to his father.",32,Juvenile Fiction,3,1,US,US,http://books.google.com/books/content?id=5yUEAwAAQBAJ&printsec=frontcover&img=1&zoom=1&edge=curl&source=gbs_api,http://books.google.com/books?id=5yUEAwAAQBAJ&printsec=frontcover&dq=isbn:9780374300210&hl=&cd=1&source=gbs_api,if animals kissed good night
9.78E+12,The Colour Kittens,Golden Books,2009-02,"While the color kittens are trying to make green paint, their mixing leads to pink, orange, and purple.",26,Juvenile Fiction,NA,NA,US,US,http://books.google.com/books/content?id=W3laMP5gkssC&printsec=frontcover&img=1&zoom=1&edge=curl&source=gbs_api,http://books.google.com/books?id=W3laMP5gkssC&printsec=frontcover&dq=isbn:9780375853357&hl=&cd=1&source=gbs_api,the color kittens
9.78E+12,How Rocket Learned to Read,Schwartz & Wade,7/27/10,"Learn to read with this New York Times-bestselling picture book, starring an irresistible dog named Rocket and his teacher, a little yellow bird. Follow along as Rocket masters the alphabet, sounds out words, and finally . . . learns to read all on his own! With a story that makes reading fun_æ”and will even help listeners learn to read_æ”this book is ideal for kindergarten classrooms and story hour or as a gift for that beginning reader. Fresh, charming art by Tad Hills, the New York Times bestselling author/illustrator of Duck & Goose, will make this a favorite. And don't miss the instant #1 New York Times Bestseller, Rocket Writes a Story. From the Hardcover edition.",40,Juvenile Fiction,4,28,US,US,http://books.google.com/books/content?id=OU2fEDd1oMIC&printsec=frontcover&img=1&zoom=1&edge=curl&source=gbs_api,http://books.google.com/books?id=OU2fEDd1oMIC&printsec=frontcover&dq=isbn:9780375989223&hl=&cd=1&source=gbs_api,how rocket learned to read
9.78E+12,The Berenstain Bears Forget Their Manners,Random House Books for Young Readers,10/27/10,"This classic Berenstain Bears story is a perfect way to teach children about the importance of good manners! Come for a visit in Bear Country with this classic First Time BookÇ¥ from Stan and Jan Berenstain. Mama has noticed that Papa, Brother, and Sister have not been using their good manners, so now it_æ_s up to her to help get back on track. Includes over 50 bonus stickers!",32,Juvenile Fiction,4,13,US,US,http://books.google.com/books/content?id=1Ww27Bsb_vYC&printsec=frontcover&img=1&zoom=1&edge=curl&source=gbs_api,http://books.google.com/books?id=1Ww27Bsb_vYC&printsec=frontcover&dq=isbn:9780375989391&hl=&cd=1&source=gbs_api,the berenstain bears forget their manners
9.78E+12,How to Babysit a Grandma,Knopf Books for Young Readers,3/25/14,"A New York Times bestseller When you babysit a grandma, if you're lucky . . . it's a sleepover at her house! And with the useful tips found in this book, you're guaranteed to become an expert grandma-sitter in no time. (Be sure to check out the sections on: How to keep a grandma busy; Things to do at the park; Possible places to sleep, and what to do once you're both snugly tucked in for the night.) From the author-illustrator team behind the New York Times bestselling HOW TO... series comes a funny and heartwarming celebration of grandmas and grandchildren.",32,Juvenile Fiction,4,8,US,US,http://books.google.com/books/content?id=Oaw9AQAAQBAJ&printsec=frontcover&img=1&zoom=1&edge=curl&source=gbs_api,http://books.google.com/books?id=Oaw9AQAAQBAJ&printsec=frontcover&dq=isbn:9780385753869&hl=&cd=1&source=gbs_api,how to babysit a grandma
9.78E+12,Hop on Pop,NA,1963,"Pairs of rhyming words are introduced and used in simple sentences, such as ""Day. Play. We play all day. Night. Fight. We fight all night.""",64,Fathers,4.5,15,US,US,http://books.google.com/books/content?id=z7cuuQEACAAJ&printsec=frontcover&img=1&zoom=1&source=gbs_api,http://books.google.com/books?id=z7cuuQEACAAJ&dq=isbn:9780394900292&hl=&cd=1&source=gbs_api,hop on pop
9.78E+12,Katy and the Big Snow,Houghton Mifflin Harcourt,1943,Geappolis is hidden under a blanket of snow until a red crawler tractor saves the day,32,Juvenile Fiction,4,10,US,US,http://books.google.com/books/content?id=KEmuXFgPB2MC&printsec=frontcover&img=1&zoom=1&edge=curl&source=gbs_api,http://books.google.com/books?id=KEmuXFgPB2MC&printsec=frontcover&dq=isbn:9780395181553&hl=&cd=1&source=gbs_api,katy and the big snow
9.78E+12,The Polar Express,Houghton Mifflin Harcourt,1985,"For twenty-five years, The Polar Express has been a treasured holiday classic. To commemorate this special anniversary, a lavish gift edition has been created. Awarded the prestigious Caldecott Medal in 1986, The Polar Express has sold more than 7 million copies, become a classic holiday movie, and been translated into stage productions that take place across the United States during the holiday season.",32,Juvenile Fiction,4.5,49,US,US,http://books.google.com/books/content?id=0zZULbHpZN8C&printsec=frontcover&img=1&zoom=1&source=gbs_api,http://books.google.com/books?id=0zZULbHpZN8C&pg=PP1&dq=isbn:9780395389492&hl=&cd=1&source=gbs_api,the polar express
9.78E+12,The Hat,Putnam Juvenile,1997,Jan Brett's heartwarming story of Hedgie the hedgehog's misadventures has become a family favorite.,32,Juvenile Fiction,4,36,US,US,http://books.google.com/books/content?id=148KAQAAMAAJ&printsec=frontcover&img=1&zoom=1&source=gbs_api,http://books.google.com/books?id=148KAQAAMAAJ&dq=isbn:9780399234613&hl=&cd=1&source=gbs_api,the hat
9.78E+12,"Good Night, Gorilla",Penguin,2004,"When an unobservant zookeeper goes home, all the animals he thinks he has left behind in the zoo follow him. On board pages.",34,Juvenile Fiction,4,49,US,US,http://books.google.com/books/content?id=frEuDwAAQBAJ&printsec=frontcover&img=1&zoom=1&edge=curl&source=gbs_api,http://books.google.com/books?id=frEuDwAAQBAJ&printsec=frontcover&dq=isbn:9780399242601&hl=&cd=1&source=gbs_api,good night gorilla
9.78E+12,"I Love You, Stinky Face",Scholastic Inc.,2/1/04,"A mother and child discuss how the mother's love would remain constant even if her child were a smelly skunk, scary ape, or bug-eating green alien. On board pages.",34,Juvenile Fiction,4.5,27,US,US,http://books.google.com/books/content?id=fhvLVxB1SUoC&printsec=frontcover&img=1&zoom=1&edge=curl&source=gbs_api,http://books.google.com/books?id=fhvLVxB1SUoC&printsec=frontcover&dq=isbn:9780439635721&hl=&cd=1&source=gbs_api,"i love you, stinky face"
9.78E+12,The Little Engine that Could,Grosset & Dunlap,1930,"When the other engines refuse, the Little Blue Engine tries to pull a stranded train full of toys and good food over the mountain.",37,Juvenile Fiction,4,72,US,US,http://books.google.com/books/content?id=okDlNrwOy1AC&printsec=frontcover&img=1&zoom=1&source=gbs_api,http://books.google.com/books?id=okDlNrwOy1AC&dq=isbn:9780448405209&hl=&cd=1&source=gbs_api,the little engine that could
9.78E+12,Llama Llama Red Pajama,Viking Books for Young Readers,5/5/15,A bedtime story. A good-night kiss. And Mama Llama turns off the light. but is everything all right? No! This classic bedtime drama is now just the right size for little hands! More Llama llama for little ones!,34,Juvenile Fiction,4.5,27,US,US,http://books.google.com/books/content?id=BN_aCwAAQBAJ&printsec=frontcover&img=1&zoom=1&edge=curl&source=gbs_api,http://books.google.com/books?id=BN_aCwAAQBAJ&printsec=frontcover&dq=isbn:9780451474575&hl=&cd=1&source=gbs_api,llama llama red pajama
9.78E+12,God Bless You and Good Night,Thomas Nelson,11/5/13,"This sweet book will make sure your little one falls to sleep feeling secure and loved. Bedtime Bibles and storybooks are evergreen classics that sell through year after year. Seasoned brands and new names alike are seeing surging sales in this felt-need genre as parents are looking for comforting books with Bible stories, verses, and prayers to settle kids down to sleep. In God Bless You and Good Night, sleepy little ones are reminded of God_æ_s blessings and how much they are loved. The delightful rhyming story takes readers through several scenes of snuggly animals who are getting ready for bed. These sweet, sometimes silly rhymes and adorable art are sure to make God Bless You and Good Night a favorite part of the bedtime ritual for parents and children.",20,Juvenile Fiction,1,1,US,US,http://books.google.com/books/content?id=JLLEAwAAQBAJ&printsec=frontcover&img=1&zoom=1&edge=curl&source=gbs_api,http://books.google.com/books?id=JLLEAwAAQBAJ&printsec=frontcover&dq=isbn:9780529109286&hl=&cd=1&source=gbs_api,god bless you and good night
9.78E+12,How Do Dinosaurs Say Happy Birthday?,Scholastic Inc.,2011,"Illustrations and rhyming text present some of the different ways a dinosaur can make her birthday party special, from thanking guests for their gifts to sharing large pieces of cake.",12,Juvenile Fiction,5,1,US,US,http://books.google.com/books/content?id=qBM80Cw9TikC&printsec=frontcover&img=1&zoom=1&edge=curl&source=gbs_api,http://books.google.com/books?id=qBM80Cw9TikC&printsec=frontcover&dq=isbn:9780545153539&hl=&cd=1&source=gbs_api,how do dinosaurs say happy birthday?
9.78E+12,I Love You Through and Through,Scholastic Inc.,12/29/15,"A rhyming story of unconditional love and adorable illustrations of a toddler and a teddy bear who declare ""I love you through and through!"" I love your hair and eyes, Your giggles and cries... A toddler and his teddy bear illustrate a young child's happy side, sad side, silly side, mad side, and more! Babies and toddlers will feel loved all over when they hear this declaration of adoration and affection! The book has sturdy cardstock pages and a padded cover with rounded corners for safe handling by little ones.",24,Juvenile Fiction,4.5,20,US,US,http://books.google.com/books/content?id=UyPFCgAAQBAJ&printsec=frontcover&img=1&zoom=1&edge=curl&source=gbs_api,http://books.google.com/books?id=UyPFCgAAQBAJ&printsec=frontcover&dq=isbn:9780545385985&hl=&cd=1&source=gbs_api,i love you through and through
9.78E+12,I Am a Big Sister,Scholastic Inc.,1/27/15,"Share the joys of becoming a big sister! With the arrival of a new baby comes many transitions, and big sisters may need a little extra tender loving care to adjust to a new family situation. This sweet story with adorable toddler illustrations by Caroline Jayne Church is just right to share with and prepare an older sister getting ready for an expanding family.",24,Juvenile Fiction,5,1,US,US,http://books.google.com/books/content?id=BfcYBAAAQBAJ&printsec=frontcover&img=1&zoom=1&edge=curl&source=gbs_api,http://books.google.com/books?id=BfcYBAAAQBAJ&printsec=frontcover&dq=isbn:9780545690072&hl=&cd=1&source=gbs_api,i am a big sister!
9.78E+12,Little Blue Truck,Houghton Mifflin Harcourt,12/6/10,"""Neigh!"" said a horse. ""Quack!"" said a duck. ""Beep!"" said the friendly Little Blue Truck. Little Blue Truck is a joyful cacophony of animal and truck sounds that will have youngsters beeping and quacking_æ”and begging for one more go-round! Along the way, readers see that it pays to be kind to our animal friends . . . if we show a friendly respect to others, we_æ_re more likely to get help when we_æ_re, say, stuck in the muck in a truck. Jill McElmurry_æ_s gouache illustrations of wild-eyed farm animals and country roads are warm and wonderful, suiting the cheerfully rhyming text to a T. Beep!",32,Juvenile Fiction,4.5,19,US,US,http://books.google.com/books/content?id=fekwAAAAQBAJ&printsec=frontcover&img=1&zoom=1&edge=curl&source=gbs_api,http://books.google.com/books?id=fekwAAAAQBAJ&printsec=frontcover&dq=isbn:9780547770222&hl=&cd=1&source=gbs_api,little blue truck
9.78E+12,Curious George,NA,12/31/41,The curiosity of a newly-captured monkey sets him into continual trouble.,46,Juvenile Fiction,NA,NA,US,US,http://books.google.com/books/content?id=zOD-YYM0KwwC&printsec=frontcover&img=1&zoom=1&source=gbs_api,http://books.google.com/books?id=zOD-YYM0KwwC&dq=isbn:9780590020435&hl=&cd=1&source=gbs_api,curious george
9.78E+12,I love my mommy because--,NA,2001,"As a child explains the many happy, loving things Mommy does, many different animal mothers are shown caring for their young.",NA,Animals,4.5,7,US,US,http://books.google.com/books/content?id=D-c01AcwpwYC&printsec=frontcover&img=1&zoom=1&source=gbs_api,http://books.google.com/books?id=D-c01AcwpwYC&dq=isbn:9780590590914&hl=&cd=1&source=gbs_api,i love my mommy because...
9.78E+12,Diary of a Wombat,Houghton Mifflin Harcourt,2003,"In his diary, a wombat describes his life of eating, sleeping, and getting to know some new human neighbors.",32,Juvenile Fiction,4.5,24,US,US,http://books.google.com/books/content?id=hODzavpFscoC&printsec=frontcover&img=1&zoom=1&edge=curl&source=gbs_api,http://books.google.com/books?id=hODzavpFscoC&printsec=frontcover&dq=isbn:9780618381364&hl=&cd=1&source=gbs_api,diary of a wombat
9.78E+12,Animalia,NA,2016,NA,NA,Animals,5,5,US,US,http://books.google.com/books/content?id=51i_jwEACAAJ&printsec=frontcover&img=1&zoom=1&source=gbs_api,http://books.google.com/books?id=51i_jwEACAAJ&dq=isbn:9780670079131&hl=&cd=1&source=gbs_api,animalia
9.78E+12,Each Peach Pear Plum,Longman,1978,Rhymed text and illustrations invite the reader to play 'I spy' with a variety of Mother Goose and other folklore characters.,32,Big books,4,20,US,US,http://books.google.com/books/content?id=WknRPgAACAAJ&printsec=frontcover&img=1&zoom=1&source=gbs_api,http://books.google.com/books?id=WknRPgAACAAJ&dq=isbn:9780582436565&hl=&cd=1&source=gbs_api,each peach pear plum
9.78E+12,Lilly's Purple Plastic Purse,Harper Collins,8/19/96,"Lilly loves everything about school, especially her cool teacher, Mr. Slinger. But when Lilly brings her purple plastic purse and its treasures to school and can't wait until sharing time, Mr. Slinger confiscates her prized possessions. Lilly's fury leads to revenge and then to remorse and she sets out to make amends. Lilly, the star of Chester's Way and Julius, the Baby of the World, is back. And this time she has her name in the title - something she's wanted all along. If you thought Lilly was funny before, you are in for a treat. So hurry up and start reading. Lilly can't wait for you to find out more about her.",40,Juvenile Fiction,4,98,US,US,http://books.google.com/books/content?id=IxJEcttj_HAC&printsec=frontcover&img=1&zoom=1&edge=curl&source=gbs_api,http://books.google.com/books?id=IxJEcttj_HAC&printsec=frontcover&dq=isbn:9780688128975&hl=&cd=1&source=gbs_api,lilly's purple plastic purse
9.78E+12,Horns to Toes and in Between,NA,1995,This is a counting book and a book about parts of the body. It also has a serious educational aim.,14,"Body, Human",NA,NA,US,US,http://books.google.com/books/content?id=hDLRAQAACAAJ&printsec=frontcover&img=1&zoom=1&source=gbs_api,http://books.google.com/books?id=hDLRAQAACAAJ&dq=isbn:9780689827419&hl=&cd=1&source=gbs_api,horns to toes and in between
9.78E+12,"Moo, Baa, la la La!",Simon & Schuster Childrens Books,2004,"Children will love joining in and imitating the animal noises and sounds in this big, bold board book format, illustrated with Sandra Boynton's seriously silly signature animals.",14,Animal sounds,4.5,48,US,US,http://books.google.com/books/content?id=Gz40AAAACAAJ&printsec=frontcover&img=1&zoom=1&source=gbs_api,http://books.google.com/books?id=Gz40AAAACAAJ&dq=isbn:9780689861130&hl=&cd=1&source=gbs_api,"moo, baa, la la la!"
9.78E+12,How to Catch a Star,Penguin,6/3/04,"From the illustrator of the #1 smash hit The Day the Crayons Quit comes a story about wishing, persevering, and reaching for the stars. Once there was a boy, and that boy loved stars very much. So much so that he decided to catch one of his very own. But how? Waiting for them to grow tired from being up in the sky all night doesn't work. Climbing to the top of the tallest tree? No, not tall enough. The boy has a rocket ship . . . but it is made of paper and doesn't fly well at all. Finally, just when the boy is ready to give up, he learns that sometimes things aren't where, or what, we expect them to be. Oliver Jeffers offers a simple, childlike tale of reaching for the stars, and emerging with a friend.",32,Juvenile Fiction,4,14,US,US,http://books.google.com/books/content?id=USAhs7EVV8YC&printsec=frontcover&img=1&zoom=1&edge=curl&source=gbs_api,http://books.google.com/books?id=USAhs7EVV8YC&printsec=frontcover&dq=isbn:9780698148772&hl=&cd=1&source=gbs_api,how to catch a star
9.78E+12,Whistle for Willie,Penguin,2/24/77,"Since it was first published in 1964, Whistle for Willie has delighted millions of young readers with its nearly wordless text and its striking collage artwork depicting the story of Peter, who longs to whistle for his dog. The New York Times wrote: ""Mr. Keats' illustrations boldly, colorfully capture the child, his city world, and the shimmering heat of a summer's day.""",32,Juvenile Fiction,3.5,27,US,US,http://books.google.com/books/content?id=Y57xAgAAQBAJ&printsec=frontcover&img=1&zoom=1&edge=curl&source=gbs_api,http://books.google.com/books?id=Y57xAgAAQBAJ&printsec=frontcover&dq=isbn:9780698165625&hl=&cd=1&source=gbs_api,whistle for willie
9.78E+12,Snuggle Puppy!,Workman Publishing,5/22/03,"A great big hug in book form, Snuggle Puppy is a year-round valentine from parent to child. It is bright, chunky, a pleasure to hold, and has a die-cut cover that reveals a glimpse of the joy inside before it's even opened. Best of all, it's packed, of course, with pure Boynton: her inimitable language, her inimitable illustrations, her inimitable sense of fun. OOO, Snuggle Puppy of mine! Everything about you is especially fine. I love what you are. I love what you do. Fuzzy little Snuggle Puppy, I love you. Featuring a sweet and cuddly doggie cast and rhyming verse, Snuggle Puppy is the perfect bedtime book to read last, because of an ending that kids will want again and again: I started with OOO. . . . Now we'll end like this: [BIG SMOOCH!] Oversized lap edition also available_æ”perfect for reading aloud!",24,Juvenile Fiction,5,12,US,US,http://books.google.com/books/content?id=drdRCwAAQBAJ&printsec=frontcover&img=1&zoom=1&edge=curl&source=gbs_api,http://books.google.com/books?id=drdRCwAAQBAJ&printsec=frontcover&dq=isbn:9780761130673&hl=&cd=1&source=gbs_api,snuggle puppy
9.78E+12,Tickle Time!,Workman Publishing,2012,Illustrations and rhyming text reveal the importance of a good tickle.,24,Board books.,4.5,3,US,US,http://books.google.com/books/content?id=L7hRCwAAQBAJ&printsec=frontcover&img=1&zoom=1&edge=curl&source=gbs_api,http://books.google.com/books?id=L7hRCwAAQBAJ&printsec=frontcover&dq=isbn:9780761168836&hl=&cd=1&source=gbs_api,tickle time
9.78E+12,Train,Workman Publishing,10/4/16,"***A 2016 National Parenting Product Awards (NAPPA) winner You_æ_ve never seen a book like this before! It_æ_s the story of a train moving across the American landscape_æ”but with an actual three-dimensional miniature train that loops up and down and across each spread, traveling along an interior track from front to back without ever leaving the pages. Move the red steam engine out of the depot and to the front of the book, where the sun is just coming up over a bay, and then take a journey across wide plains, up mountains and down hills, into a city at night with its beacons of light_æ”and finally, back to the rail yard. The panoramic landscapes are filled with marvelous details that young children will delight in discovering, and the sweet, simple rhyming language pulls the story along and will be happily repeated when it_æ_s time to start the journey all over again. All aboard!",14,Juvenile Fiction,NA,NA,US,US,http://books.google.com/books/content?id=KO0MDAAAQBAJ&printsec=frontcover&img=1&zoom=1&edge=curl&source=gbs_api,http://books.google.com/books?id=KO0MDAAAQBAJ&printsec=frontcover&dq=isbn:9780761187165&hl=&cd=1&source=gbs_api,train
