isbn,title,publisher,published_date,publisher_desription,n_pages,category,mean_rating,num_ratings,sale_country,access_country,cover_thumbnail_url,preview_url,title_us
9.78E+12,The Runaway Bunny,Harper Collins,1/18/05,"A little bunny keeps runningaway from his mother in an imaginative and imaginary game of verbal hide-and-seek; children will be profoundly comforted by this lovingly steadfast mother who finds her child every time. The Runaway Bunny, first published in 1942 and never out of print, has indeed become a classic. Generations of readers have fallen in love with the gentle magic of its reassuring words and loving pictures.",48,Juvenile Fiction,2.5,17,US,US,http://books.google.com/books/content?id=Kr3QSOrKoGYC&printsec=frontcover&img=1&zoom=1&edge=curl&source=gbs_api,http://books.google.com/books?id=Kr3QSOrKoGYC&printsec=frontcover&dq=isbn:9780060775827&hl=&cd=1&source=gbs_api,the runaway bunny
9.78E+12,Goodnight Moon,HarperCollins,11/8/16,"Share this timeless classic with a new generation of readers! In a great green room, tucked away in bed, is a little bunny. ""Goodnight room, goodnight moon."" And to all the familiar things in the softly lit room_æ”to the picture of the three little bears sitting on chairs, to the clocks and his socks, to the mittens and the kittens, to everything one by one_æ”the little bunny says goodnight. In this classic of children's literature, beloved by generations of readers and listeners, the quiet poetry of the words and the gentle, lulling illustrations combine to make a perfect book for the end of the day.",32,Juvenile Fiction,4,196,US,US,http://books.google.com/books/content?id=dJNoDQAAQBAJ&printsec=frontcover&img=1&zoom=1&edge=curl&source=gbs_api,http://books.google.com/books?id=dJNoDQAAQBAJ&printsec=frontcover&dq=isbn:9780062662897&hl=&cd=1&source=gbs_api,goodnight moon
9.78E+12,The Grouchy Ladybug,Harper Collins,8/16/96,"It's the Grouchy Ladybug's 20th birthday. To celebrate, we are introducing a new, larger format edition with brighter, more colorful pages created from Eric Carle's original artwork using the latest reproduction technology. The Grouchy Ladybug is bigger and brigher, as irascible but irresistable as ever and will surely delight new generations of readers, as well as her devoted fans of all ages. Happy Birthday, Grouchy Ladybug!",48,Juvenile Fiction,4,84,US,US,http://books.google.com/books/content?id=0dXL2Cysc-QC&printsec=frontcover&img=1&zoom=1&edge=curl&source=gbs_api,http://books.google.com/books?id=0dXL2Cysc-QC&printsec=frontcover&dq=isbn:9780064434508&hl=&cd=1&source=gbs_api,the grouchy ladybug
9.78E+12,The Monster at the End of this Book,NA,2017,Grover worries about meeting the monster at the end of this book.,NA,Grover (Fictitious character : Henson),5,2,US,US,http://books.google.com/books/content?id=rmx9tgEACAAJ&printsec=frontcover&img=1&zoom=1&source=gbs_api,http://books.google.com/books?id=rmx9tgEACAAJ&dq=isbn:9780375976506&hl=&cd=1&source=gbs_api,the monster at the end of this book
9.78E+12,The Little House,Houghton Mifflin Harcourt,1969,"A country house is unhappy when the city, with all its buildings and traffic, grows up around her.",40,Juvenile Fiction,4,56,US,US,http://books.google.com/books/content?id=toD6rw6PpnEC&printsec=frontcover&img=1&zoom=1&edge=curl&source=gbs_api,http://books.google.com/books?id=toD6rw6PpnEC&printsec=frontcover&dq=isbn:9780395181560&hl=&cd=1&source=gbs_api,the little house
9.78E+12,The Very Hungry Caterpillar,NA,1969,"Follows the progress of a hungry little caterpiller as he eats his way through a varied and very large quantity of food until, full at last, he forms a cocoon around himself and goes to sleep.",20,Butterflies,4,108,US,US,http://books.google.com/books/content?id=9kl_ZwEACAAJ&printsec=frontcover&img=1&zoom=1&source=gbs_api,http://books.google.com/books?id=9kl_ZwEACAAJ&dq=isbn:9780399255564&hl=&cd=1&source=gbs_api,the very hungry caterpillar
9.78E+12,The Napping House,Houghton Mifflin Harcourt,9/9/14,"Delightful cumulative rhyme leads up to the consequences of piling too many sleepy people and animals in a cozy bed. _æ_Don Wood_æ_s paintings endow Audrey_æ_s familiar plot with beauty and newness, conveying atmosphere as well as illustrating the story._æ--Publishers Weekly",32,Juvenile Fiction,4.5,24,US,US,http://books.google.com/books/content?id=onNjBwAAQBAJ&printsec=frontcover&img=1&zoom=1&edge=curl&source=gbs_api,http://books.google.com/books?id=onNjBwAAQBAJ&printsec=frontcover&dq=isbn:9780547848488&hl=&cd=1&source=gbs_api,the napping house
9.78E+12,If You Give a Mouse a Cookie,Scholastic Paperbacks,6/1/88,"If you give a mouse a cookie, he's going to ask for a glass of milk and that's only the beginning!",19,Juvenile Fiction,4,168,US,US,http://books.google.com/books/content?id=h-YKhhYpTzIC&printsec=frontcover&img=1&zoom=1&source=gbs_api,http://books.google.com/books?id=h-YKhhYpTzIC&dq=isbn:9780590402330&hl=&cd=1&source=gbs_api,if you give a mouse a cookie
9.78E+12,The Snowy Day,Penguin,2012,The adventures of a little boy in the city on a very snowy day. On board pages.,32,Juvenile Fiction,4,198,US,US,http://books.google.com/books/content?id=Hu4iDAAAQBAJ&printsec=frontcover&img=1&zoom=1&edge=curl&source=gbs_api,http://books.google.com/books?id=Hu4iDAAAQBAJ&printsec=frontcover&dq=isbn:9780670013258&hl=&cd=1&source=gbs_api,the snowy day
9.78E+12,Harold and the Purple Crayon,Perfection Learning,5/1/81,"First published in 1955, this classic tells the story of young Harold, whose purple crayon and his imagination take him on wonderful adventures. Full color.",64,Juvenile Fiction,4,60,US,US,http://books.google.com/books/content?id=W38uPwAACAAJ&printsec=frontcover&img=1&zoom=1&source=gbs_api,http://books.google.com/books?id=W38uPwAACAAJ&dq=isbn:9780812432435&hl=&cd=1&source=gbs_api,harold and the purple crayon
9.78E+12,Mama Don't Allow,Turtleback,1985-07,"Miles teams up with three other musicians to form the Swamp Band, in a tale inspired by an American folksong.",NA,Juvenile Fiction,3.5,2,US,US,http://books.google.com/books/content?id=yMkCAAAACAAJ&printsec=frontcover&img=1&zoom=1&source=gbs_api,http://books.google.com/books?id=yMkCAAAACAAJ&dq=isbn:9780808536987&hl=&cd=1&source=gbs_api,mama don't allow
9.78E+12,Alligator Pie,HarperCollins,10/28/14,"A slice of Alligator Pie_æ”sized for little ones! One of the best loved Canadian poems of all time, _æ_Alligator Pie_æ established Dennis Lee_æ_s reputation as _æ_Canada_æ_s Father Goose_æ when it appeared in his classic poetry collection of the same name in 1974. Now Lee's timeless rhyme is paired with striking artwork by Sandy Nichols, winner of a nationwide competition to find the perfect illustrator for the iconic poem. This special 40th anniversary edition will stand up to re-readings for years to come and is a must-have for every baby and preschooler's library.",13,Juvenile Nonfiction,NA,NA,US,US,http://books.google.com/books/content?id=kArNBAAAQBAJ&printsec=frontcover&img=1&zoom=1&edge=curl&source=gbs_api,http://books.google.com/books?id=kArNBAAAQBAJ&printsec=frontcover&dq=isbn:9781443442152&hl=&cd=1&source=gbs_api,alligator pie
9.78E+12,Animals,Dk Pub,2008-01,"Invites young readers to feel the textures of animals, including puppies, elephants, starfish, and snails. On board pages.",14,Juvenile Nonfiction,NA,NA,US,US,http://books.google.com/books/content?id=4eL7QwAACAAJ&printsec=frontcover&img=1&zoom=1&source=gbs_api,http://books.google.com/books?id=4eL7QwAACAAJ&dq=isbn:9780756634681&hl=&cd=1&source=gbs_api,baby touch and feel: animals
9.78E+12,Belly Button Book!,Workman Publishing Company,2011-10,Hippopotamuses celebrate their belly buttons.,24,Juvenile Fiction,4.5,39,US,US,http://books.google.com/books/content?id=AEieKQEACAAJ&printsec=frontcover&img=1&zoom=1&source=gbs_api,http://books.google.com/books?id=AEieKQEACAAJ&dq=isbn:9780761166184&hl=&cd=1&source=gbs_api,belly button book
9.78E+12,Richard Scarry's Cars and Trucks and Things that Go,Golden Books,1974,On their way to the beach for a picnic the Pig family encounters almost every kind of transportation vehicle imaginable--and imaginary.,69,Juvenile Nonfiction,4.5,5,US,US,http://books.google.com/books/content?id=tmZeR-bJ53QC&printsec=frontcover&img=1&zoom=1&edge=curl&source=gbs_api,http://books.google.com/books?id=tmZeR-bJ53QC&printsec=frontcover&dq=isbn:9780307157850&hl=&cd=1&source=gbs_api,cars and trucks and things that go
9.78E+12,Chugga Chugga Choo-Choo Board Book,Hyperion,3/1/01,"A rhyming story about a toy freight train's day, from loading freight in the morning to retiring to the roundhouse after the day's work is done. On board pages.",32,Juvenile Fiction,NA,NA,US,US,http://books.google.com/books/content?id=tINTnwEACAAJ&printsec=frontcover&img=1&zoom=1&source=gbs_api,http://books.google.com/books?id=tINTnwEACAAJ&dq=isbn:9780786807604&hl=&cd=1&source=gbs_api,chugga-chugga choo-choo
9.78E+12,"Click, Clack, Moo",Simon and Schuster,12/13/16,"New York Times bestselling duo Doreen Cronin and Betsy Lewin_æ_s Caldecott Honor_æ_winning book is now available as a Level 2 Ready-to-Read! Farmer Brown has a problem. His cows like to type. All day long he hears: Click, clack, moo. Click, clack, moo. Click, clack, moo. But Farmer Brown_æ_s problems REALLY begin when his cows start leaving him notes! Come join the fun as a bunch of literate cows turn Farmer Brown_æ_s farm upside-down!",32,Juvenile Fiction,4.5,12,US,US,http://books.google.com/books/content?id=nbepDQAAQBAJ&printsec=frontcover&img=1&zoom=1&edge=curl&source=gbs_api,http://books.google.com/books?id=nbepDQAAQBAJ&printsec=frontcover&dq=isbn:9781481465403&hl=&cd=1&source=gbs_api,"click, clack, moo: cows that type"
9.78E+12,Don't Let the Pigeon Drive the Bus!,Hyperion,4/1/03,"When a bus driver takes a break from his route, a very unlikely volunteer springs up to take his place-a pigeon! But you've never met one like this before. As he pleads, wheedles, and begs his way through the book, children will love being able to answer back and decide his fate. In his hilarious picture book debut, popular cartoonist Mo Willems perfectly captures a preschooler's temper tantrum.",40,Juvenile Fiction,4,166,US,US,http://books.google.com/books/content?id=bNsXuQEACAAJ&printsec=frontcover&img=1&zoom=1&source=gbs_api,http://books.google.com/books?id=bNsXuQEACAAJ&dq=isbn:9780786819881&hl=&cd=1&source=gbs_api,don't let the pigeon drive the bus
9.78E+12,Today I Will Fly! (An Elephant and Piggie Book),Hyperion,3/13/07,"Gerald is careful. Piggie is not. Piggie cannot help smiling. Gerald can. Gerald worries so that Piggie does not have to. Gerald and Piggie are best friends./DIVDIV Today, I Will Fly! is the funny introduction to the characters. Piggie is determined to fly. But Gerald the elephant knows that's impossible--isn't it?",64,Juvenile Fiction,2,1,US,US,http://books.google.com/books/content?id=9DdeugEACAAJ&printsec=frontcover&img=1&zoom=1&source=gbs_api,http://books.google.com/books?id=9DdeugEACAAJ&dq=isbn:9781423102953&hl=&cd=1&source=gbs_api,elephant and piggy: today i will fly!
9.78E+12,Kay Thompson's Eloise,Simon & Schuster Children's Publishing,1983,"Six-year-old Eloise lives with her mother and her English nanny at the Plaza Hotel, where she finds many opportunities to indulge in mischief",65,Juvenile Fiction,4,36,US,US,http://books.google.com/books/content?id=T3JWAAAAYAAJ&printsec=frontcover&img=1&zoom=1&source=gbs_api,http://books.google.com/books?id=T3JWAAAAYAAJ&dq=isbn:9780671223502&hl=&cd=1&source=gbs_api,eloise
9.78E+12,Frog and Toad Are Friends,Harper Collins,10/3/79,"From writing letters to going swimming, telling stories to finding lost buttons, Frog and Toad are always there for each other_æ”just as best friends should be.",64,Juvenile Fiction,4.5,7,US,US,http://books.google.com/books/content?id=dtyVtv8JHXwC&printsec=frontcover&img=1&zoom=1&source=gbs_api,http://books.google.com/books?id=dtyVtv8JHXwC&dq=isbn:9780064440202&hl=&cd=1&source=gbs_api,frog and toad
9.78E+12,From Head to Toe Board Book,Harper Collins,3/27/99,"What does an elephant do? It stomps its foot. Can you? From the creator of such beloved classics as The Grouchy Ladybug and The Mixed-Up Chameleon comes this interactive story that invites kids to imitate animal movements. Watching giraffes bend their necks or monkeys wave their arms is fun, but nothing could be better than joining in. From their heads down to their toes, kids will be wriggling, jiggling, and giggling as they try to keep up with these animals!Alligators wiggle, elephants stop, gorillas thump, and giraffes bend. Can you do it? _æ„ I can do it!_æ_ is the confidence-building message of this fun-filled interactive picture book. A variety of familiar animals invite young children to copy their antics, and as they play, they will learn such important skills as careful listening, focusing attention, and following instructions. Just as alphabet books introduce the very young child to letters and simple words, From Head to Toe introduces the basic body parts and simple body movements. And in the same way that children progress from understanding simple words to reading and writing sentences and stories, so they will progress from simple body movements to dancing, gymnastics, and other sports and activities, with confidence and pleasure. Eric Carle's colorful collages have delighted children for more than a generation. Each book provides hours of fun while encouraging them to stretch their imaginations. His matchless words and illustrations now send out a new challenge: Are you ready? Here we go! Move yourself From Head to Toe. A Main Selection of the Children_æ_s Book-of-the-Month Club",28,Juvenile Fiction,4,49,US,US,http://books.google.com/books/content?id=cLw2UqfAeDsC&printsec=frontcover&img=1&zoom=1&edge=curl&source=gbs_api,http://books.google.com/books?id=cLw2UqfAeDsC&printsec=frontcover&dq=isbn:9780694013012&hl=&cd=1&source=gbs_api,from head to toe
9.78E+12,"Go, Dog, Go!",Random House Books for Young Readers,1961,"Different kinds of dogs drive cars, wear hats, run around in mazes, and even have wild parties in treetops.",64,Juvenile Fiction,4,51,US,US,http://books.google.com/books/content?id=mAi8oBp2mZ8C&printsec=frontcover&img=1&zoom=1&source=gbs_api,http://books.google.com/books?id=mAi8oBp2mZ8C&dq=isbn:9780394800202&hl=&cd=1&source=gbs_api,"go, dog. go!"
9.78E+12,"Goodnight, Goodnight Construction Site",Chronicle Books,5/4/11,"The #1 New York Times bestseller As the sun sets behind the big construction site, all the hardworking trucks get ready to say goodnight. One by one, Crane Truck, Cement Mixer, Dump Truck, Bulldozer, and Excavator finish their work and lie down to rest_æ”so they'll be ready for another day of rough and tough construction play! With irresistible artwork by best-selling illustrator Tom Lichtenheld and sweet, rhyming text, this book will have truck lovers of all ages begging for more. Can't get enough of these tough trucks? The long-awaited sequel Mighty, Mighty, Construction Site is now available for preorder!",32,Juvenile Fiction,4,63,US,US,http://books.google.com/books/content?id=5ZcauwEACAAJ&printsec=frontcover&img=1&zoom=1&source=gbs_api,http://books.google.com/books?id=5ZcauwEACAAJ&dq=isbn:9780811877824&hl=&cd=1&source=gbs_api,"goodnight, goodnight, construction site"
9.78E+12,"Dr. Seuss's Happy Birthday, Baby!",Random House Books for Young Readers,2009,"""With Seussian stuff to touch, spin, and sniff. Based on and inspired by Dr. Seuss's Happy birthday to you!""--Cover.",10,Juvenile Fiction,4.5,4,US,US,http://books.google.com/books/content?id=rEE9rG1UdW4C&printsec=frontcover&img=1&zoom=1&edge=curl&source=gbs_api,http://books.google.com/books?id=rEE9rG1UdW4C&printsec=frontcover&dq=isbn:9780375846212&hl=&cd=1&source=gbs_api,"happy birthday, baby!"
9.78E+12,Jamberry Board Book,Harper Collins,1/6/95,"Hatberry Shoeberry In my canoeberry Under the bridge And over the dam Looking for berries Berries for jam They're off...a boy and an endearing, rhyme-spouting bear, who squires him through a fantastic world of berries. And their adventure comes to a razzamatazz finale under a starberry sky. Children will want to feast again and again on Bruce Degen's exuberant, colorful pictures and his rollicking, berryful rhymes. A young boy and a bear joyously romp through the land of berries where there are raspberry rabbits and a brassberry band with elephants skating on strawberry jam!Bruce Degen's exuberant tale, with his equally energetic and vibrant illustrations, is now a quality board book.",34,Juvenile Fiction,4.5,16,US,US,http://books.google.com/books/content?id=pJkF8-r0kzMC&printsec=frontcover&img=1&zoom=1&edge=curl&source=gbs_api,http://books.google.com/books?id=pJkF8-r0kzMC&printsec=frontcover&dq=isbn:9780694006519&hl=&cd=1&source=gbs_api,jamberry
9.78E+12,Lon Po Po,Penguin,1989,Three sisters staying home alone are endangered by a hungry wolf who is disguised as their grandmother.,32,Juvenile Fiction,4.5,8,US,US,http://books.google.com/books/content?id=m-gKDAAAQBAJ&printsec=frontcover&img=1&zoom=1&edge=curl&source=gbs_api,http://books.google.com/books?id=m-gKDAAAQBAJ&printsec=frontcover&dq=isbn:9780399216190&hl=&cd=1&source=gbs_api,lon po po: a red riding hood story from china
9.78E+12,Miss Nelson is Missing!,Houghton Mifflin Harcourt,1977,The arrival of a strict substitute convinces Miss Nelson's students that they must get their teacher back.,32,Juvenile Fiction,4,66,US,US,http://books.google.com/books/content?id=RE96I7BFGcwC&printsec=frontcover&img=1&zoom=1&edge=curl&source=gbs_api,http://books.google.com/books?id=RE96I7BFGcwC&printsec=frontcover&dq=isbn:9780395401460&hl=&cd=1&source=gbs_api,miss nelson is missing
9.78E+12,Numbers Colors Shapes,Macmillan,5/10/11,"Labeled pictures introduce words for items and concepts grouped into sections for numbers, colors, and shapes. On board pages.",26,Juvenile Nonfiction,3,1,US,US,http://books.google.com/books/content?id=P0RrAwAAQBAJ&printsec=frontcover&img=1&zoom=1&edge=curl&source=gbs_api,http://books.google.com/books?id=P0RrAwAAQBAJ&printsec=frontcover&dq=isbn:9780312510817&hl=&cd=1&source=gbs_api,"numbers, colors, shapes"
9.78E+12,Oh My Oh My Oh Dinosaurs!,Workman Publishing,1993,Dinosaurs engage in such activities as sunbathing and creating art. On board pages with a die-cut cover.,20,Juvenile Fiction,4,8,US,US,http://books.google.com/books/content?id=5bdRCwAAQBAJ&printsec=frontcover&img=1&zoom=1&edge=curl&source=gbs_api,http://books.google.com/books?id=5bdRCwAAQBAJ&printsec=frontcover&dq=isbn:9781563054419&hl=&cd=1&source=gbs_api,oh my oh my oh my dinosaurs!
9.78E+12,"Oh, the Places You'll Go!",Random House Books for Young Readers,1990,"Filled with wit, wisdom and insight, Dr. Seuss humourously considers the ups and downs of life. Grades K-3 and older.",48,Juvenile Fiction,4.5,70,US,US,http://books.google.com/books/content?id=7vY2uQEACAAJ&printsec=frontcover&img=1&zoom=1&source=gbs_api,http://books.google.com/books?id=7vY2uQEACAAJ&dq=isbn:9780679805274&hl=&cd=1&source=gbs_api,"oh, the places you'll go"
9.78E+12,"Oh, the things you can thinks!",Random House Books for Young Readers,1975,"Back in 1957, Theodor Geisel responded to an article in Life magazine that lamented the use of boring reading primers in schools. Using the pseudonym of ""Dr. Seuss"" (Seuss was Geisel's middle name) and only two hundred twenty-three words, Geisel created a replacement for those dull primers: ""The Cat in the Hat."" The instant success of the book prompted Geisel and his wife to found Beginner Books, and Geisel wrote many popular books in this series, including ""Hop on Pop, "" ""Fox in Socks, "" and ""Green Eggs and Ham."" Other favorite titles in this series are ""Go, Dog, Go!"" and ""Are You My Mother?"" by P. D. Eastman, ""A Fly Went By, "" by Mike McClintock, and ""Put Me in the Zoo, "" by Robert Lopshire. These affordable hardcover books combine large print, easy vocabulary, and large, bright illustrations in stories kids will want to read again and again. Grades 1 - Grades 2.",41,Juvenile Fiction,4,23,US,US,http://books.google.com/books/content?id=C5kvSifStIIC&printsec=frontcover&img=1&zoom=1&edge=curl&source=gbs_api,http://books.google.com/books?id=C5kvSifStIIC&printsec=frontcover&dq=isbn:9780394831299&hl=&cd=1&source=gbs_api,"oh, the thinks you can think!"
9.78E+12,"One Fish, Two Fish, Red Fish, Blue Fish",Random House Books for Young Readers,1988,"Illus. in full color. A ""fabulous book of easy words, exciting pictures and inviting rhythm.""--""Elementary English.",62,Juvenile Fiction,4,89,US,US,http://books.google.com/books/content?id=AdqjCxxY69MC&printsec=frontcover&img=1&zoom=1&edge=curl&source=gbs_api,http://books.google.com/books?id=AdqjCxxY69MC&printsec=frontcover&dq=isbn:9780394800134&hl=&cd=1&source=gbs_api,one fish two fish red fish blue fish
9.78E+12,Pete the Cat: The Wheels on the Bus Board Book,HarperFestival,6/23/15,"Join Pete the Cat and his pals in New York Times bestselling author James Dean_æ_s Pete the Cat: The Wheels on the Bus as they head to school in this groovy version of _æ_The Wheels on the Bus_æ_æ”now in board book format, perfect for little hands!",32,Juvenile Fiction,NA,NA,US,US,http://books.google.com/books/content?id=ConDoQEACAAJ&printsec=frontcover&img=1&zoom=1&source=gbs_api,http://books.google.com/books?id=ConDoQEACAAJ&dq=isbn:9780062358523&hl=&cd=1&source=gbs_api,pete the cat: the wheels on the bus
9.78E+12,Puppy Birthday to You!,Golden Books,2015,"""Based on the screenplay 'Pups turn on the lights' by Scott Albert.""",24,Juvenile Fiction,NA,NA,US,US,http://books.google.com/books/content?id=0BbBDAAAQBAJ&printsec=frontcover&img=1&zoom=1&edge=curl&source=gbs_api,http://books.google.com/books?id=0BbBDAAAQBAJ&printsec=frontcover&dq=isbn:9780553522778&hl=&cd=1&source=gbs_api,puppy birthday to you! (paw patrol)
9.78E+12,She Persisted,Penguin,2017,"""A nonfiction picture book compilation of the stories of 13 American women who persisted in overcoming obstacles and changing the world""--Provided by publisher.",32,JUVENILE NONFICTION,5,1,US,US,http://books.google.com/books/content?id=8EoxDwAAQBAJ&printsec=frontcover&img=1&zoom=1&edge=curl&source=gbs_api,http://books.google.com/books?id=8EoxDwAAQBAJ&printsec=frontcover&dq=isbn:9781524741723&hl=&cd=1&source=gbs_api,she persisted: 13 american women who changed the world
9.78E+12,Spaghetti in a Hot Dog Bun,Maria Dismondy Incorporated,2008-08,"Even though she is teased by a boy at school for being different, Lucy has the courage to be herself and comes to the boy's aid when he is in need of help.",32,Juvenile Fiction,NA,NA,US,US,http://books.google.com/books/content?id=uJcNKQEACAAJ&printsec=frontcover&img=1&zoom=1&source=gbs_api,http://books.google.com/books?id=uJcNKQEACAAJ&dq=isbn:9780615473932&hl=&cd=1&source=gbs_api,spaghetti in a hot dog bun: having the courage to be who you are
9.78E+12,The Going-To-Bed Book,Little Simon,11/30/82,"Getting ready for sleep is tons of fun in this special anniversary edition of a Sandra Boynton classic. The sun has set not long ago. Now everybody goes below to take a bath in one big tub with soap all over_æ”SCRUB SCRUB SCRUB! This classic bedtime story is just right for winding down the day as a joyful, silly group of animals scrub scrub scrub in the tub, brush and brush and brush their teeth, and finally rock and rock and rock to sleep. This anniversary edition has an enlarged trim size and metallic ink on the cover, making this Boynton classic even more special.",14,Juvenile Fiction,5,1,US,US,http://books.google.com/books/content?id=oe8CAAAACAAJ&printsec=frontcover&img=1&zoom=1&source=gbs_api,http://books.google.com/books?id=oe8CAAAACAAJ&dq=isbn:9780671449025&hl=&cd=1&source=gbs_api,the going to bed book
9.78E+12,The True Story of the 3 Little Pigs,Penguin,1996,The wolf gives his own outlandish version of what really happened when he tangled with the three little pigs.,32,Comics & Graphic Novels,4.5,4,US,US,http://books.google.com/books/content?id=pIouDwAAQBAJ&printsec=frontcover&img=1&zoom=1&edge=curl&source=gbs_api,http://books.google.com/books?id=pIouDwAAQBAJ&printsec=frontcover&dq=isbn:9780140544510&hl=&cd=1&source=gbs_api,the true story of the 3 little pigs!
9.78E+12,"Go, Train, Go!",Random House Books for Young Readers,2006-01,Easy-to-read text tells how cautious Thomas gives a ride to a judge who is in a big hurry to get to a train show. On board pages.,24,Juvenile Fiction,4.5,32,US,US,http://books.google.com/books/content?id=DyjhAAAACAAJ&printsec=frontcover&img=1&zoom=1&source=gbs_api,http://books.google.com/books?id=DyjhAAAACAAJ&dq=isbn:9780375834615&hl=&cd=1&source=gbs_api,"thomas and friends: go, train, go!"
9.78E+12,Thomas the Tank Engine: The Very First Stories (Thomas & Friends),Random House Books for Young Readers,7/28/15,"With the first four tales ever written about Thomas the Tank Engine and illustrated with the art from the original book, this hardcover storybook is a must-have for every Thomas & Friends fan! First published in 1946, the stories launched Thomas firmly into the hearts of countless train-loving little boys and their families, where he has remained ever since. This beautifully designed new version of timeless favorite tales makes it a classic for today, tomorrow, and always!",40,Juvenile Fiction,NA,NA,US,US,http://books.google.com/books/content?id=26T4oQEACAAJ&printsec=frontcover&img=1&zoom=1&source=gbs_api,http://books.google.com/books?id=26T4oQEACAAJ&dq=isbn:9780553523355&hl=&cd=1&source=gbs_api,thomas the tank engine: the very first stories
