isbn,title,publisher,published_date,publisher_desription,n_pages,category,mean_rating,num_ratings,sale_country,access_country,cover_thumbnail_url,preview_url,title_us
9.78E+12,Hug,NA,2000,"This package comprises a sturdy board book Hug, about a little chimp called Bobo searching for a hug; a cute cuddly soft-toy of Bobo; and a quality canvas bag to carry them both around in.",34,Children's stories,4,10,US,US,http://books.google.com/books/content?id=iBFxAAAACAAJ&printsec=frontcover&img=1&zoom=1&source=gbs_api,http://books.google.com/books?id=iBFxAAAACAAJ&dq=isbn:9780744592870&hl=&cd=1&source=gbs_api,hug
9.78E+12,Library Lion,Candlewick Press,2009,A lion starts visiting the local library but runs into trouble as he tries to both obey the rules and help his librarian friend.,48,Juvenile Fiction,4,43,US,US,http://books.google.com/books/content?id=PUELvdU5oPAC&printsec=frontcover&img=1&zoom=1&edge=curl&source=gbs_api,http://books.google.com/books?id=PUELvdU5oPAC&printsec=frontcover&dq=isbn:9780763637842&hl=&cd=1&source=gbs_api,library lion
9.78E+12,How to Train a Train,Candlewick Press,2013,"A whimsical guide to training a ""pet train"" instructs young enthusiasts about important issues including where trains live, what they like to eat, and how to get them to perform the best train tricks.",48,Juvenile Fiction,4,1,US,US,http://books.google.com/books/content?id=3E_xrHVoOxQC&printsec=frontcover&img=1&zoom=1&edge=curl&source=gbs_api,http://books.google.com/books?id=3E_xrHVoOxQC&printsec=frontcover&dq=isbn:9780763663070&hl=&cd=1&source=gbs_api,how to train a train
9.78E+12,Knuffle Bunny,Hyperion,7/12/04,"After a fun day with Daddy at the local Laundromat, Trixie quickly notices that her cherished Knuffle Bunny is missing and turns to her father to help her get him back, in a quirky tale about a special daddy-daughter adventure. Teacher's Guide available. By the author of Don't Let the Pigeon Drive the Bus.",40,Juvenile Fiction,3,2,US,US,http://books.google.com/books/content?id=rB-UQgAACAAJ&printsec=frontcover&img=1&zoom=1&source=gbs_api,http://books.google.com/books?id=rB-UQgAACAAJ&dq=isbn:9780786818709&hl=&cd=1&source=gbs_api,knuffle bunny
9.78E+12,"Baby Bear, Baby Bear, What Do You See",Macmillan,7/7/09,Illustrations and rhyming text portray a young bear searching for its mother and meeting many North American animals along the way.,13,Animals,3.5,2,US,US,http://books.google.com/books/content?id=y4IlKsJ-3UYC&printsec=frontcover&img=1&zoom=1&edge=curl&source=gbs_api,http://books.google.com/books?id=y4IlKsJ-3UYC&printsec=frontcover&dq=isbn:9780805091335&hl=&cd=1&source=gbs_api,"baby bear, baby bear, what do you see?"
9.78E+12,Sometimes I Like to Curl Up in a Ball,"Sterling Publishing Company, Inc.",2001,"A little wombat has an active day running, jumping, and playing in the mud, but his favorite time is when he can find a soft, cozy spot to curl up into a ball and go to sleep.",24,Juvenile Fiction,5,8,US,US,http://books.google.com/books/content?id=0mFzSxirgNEC&printsec=frontcover&img=1&zoom=1&edge=curl&source=gbs_api,http://books.google.com/books?id=0mFzSxirgNEC&printsec=frontcover&dq=isbn:9780806979434&hl=&cd=1&source=gbs_api,sometimes i like to curl up in a ball
9.78E+12,Olivia . . . and the Missing Toy,Simon and Schuster,3/3/11,"Olivia has one toy that she loves more than anything. She feeds him, dresses him and takes him everywhere. So when he disappears, Olivia is FURIOUS! She looks under the rug, under the sofa, under the cat. She shouts at Ian and baby William, she cries, she stomps... all to no avail. Then, one dark and stormy night, Olivia hears a noise... Clutching a candelabra, she creeps bravely into her bedroom, and sees a huge menacing shadow on the wall. Who is this monster, and what's that hanging from his jaws? All is resolved peacefully in this entertaining story starring our favourite pig and her favourite toy.",44,Juvenile Fiction,4,15,US,US,http://books.google.com/books/content?id=zMWpig6GfbMC&printsec=frontcover&img=1&zoom=1&edge=curl&source=gbs_api,http://books.google.com/books?id=zMWpig6GfbMC&printsec=frontcover&dq=isbn:9780857073488&hl=&cd=1&source=gbs_api,olivia. . . and the missing toy
9.78E+12,Dinosaur Rescue!,NA,2014-01,"When a crew of builder dinosaurs break down on a level crossing, they know the only thing they can do to save themselves is to call Dinosaur Rescue In no time at all, help is on its way, but will the Dinosaur Rescue team get there in time to stop the train?",32,Children's stories,NA,NA,US,US,http://books.google.com/books/content?id=gX4WngEACAAJ&printsec=frontcover&img=1&zoom=1&source=gbs_api,http://books.google.com/books?id=gX4WngEACAAJ&dq=isbn:9780857631671&hl=&cd=1&source=gbs_api,dinosaur rescue
9.78E+12,Show Dog,Kidz Entertainment Inc,NA,NA,NA,NA,NA,NA,US,US,http://books.google.com/books/content?id=isBg-nMqQuwC&printsec=frontcover&img=1&zoom=1&edge=curl&source=gbs_api,http://books.google.com/books?id=isBg-nMqQuwC&printsec=frontcover&dq=isbn:9780979504969&hl=&cd=1&source=gbs_api,show dog
9.78E+12,"Kindergarten, Here I Come!",Penguin,6/14/12,"Get ready for school with these fun poems! This adorable picture book celebrates all the familiar milestones and moments shared by every single kindergartener. Whether it's the first-day-of-school jitters or the hundredth-day-of-school party, every aspect of the kindergarten experience is introduced with a light and funny poem--not to mention charming illustrations.",32,Juvenile Fiction,4.5,2,US,US,http://books.google.com/books/content?id=3yHJpReSO6wC&printsec=frontcover&img=1&zoom=1&edge=curl&source=gbs_api,http://books.google.com/books?id=3yHJpReSO6wC&printsec=frontcover&dq=isbn:9781101642764&hl=&cd=1&source=gbs_api,"kindergarten, here i come!"
9.78E+12,Ladybug Girl at the Beach,Penguin,5/18/10,"It is preschooler Lulu_æ_s first time at the beach and she needs to conquer her fear of the ocean in this hardcover picture book from the New York Times bestselling Ladybug Girl series. Lulu has never been to the beach but she knows she is going to love it_æ_until she sees just how big and loud the ocean is. She and her dog Bingo decide that they will make sandcastles, fly kites, and get ice cream instead of swimming. But then the ocean waves snatch Lulu_æ_s favorite pail. This is a job for Ladybug Girl! When Lulu is Ladybug Girl, she is brave and nothing can stop her from rescuing her pail _æ_ and suddenly she is in the ocean and it is fun! This story is the perfect preparation for a first beach vacation, or to explore a new experience with a preschooler. Mama and Papa are never far away while Ladybug Girl builds up her courage and confronts something scary for the first time. For fans of Fancy Nancy and Angelina Ballerina, the Ladybug Girl series honors courage, creativity, and a love of nature!",40,Juvenile Fiction,3.5,9,US,US,http://books.google.com/books/content?id=1ekBkj88uyMC&printsec=frontcover&img=1&zoom=1&edge=curl&source=gbs_api,http://books.google.com/books?id=1ekBkj88uyMC&printsec=frontcover&dq=isbn:9781101654439&hl=&cd=1&source=gbs_api,ladybug girl at the beach
9.78E+12,The Red Balloon,Doubleday Books for Young Readers,2016-05,A small boy follows a red balloon as it drifts around Paris - sometimes just out of reach.,48,JUVENILE FICTION,NA,NA,US,US,http://books.google.com/books/content?id=JXEIDAAAQBAJ&printsec=frontcover&img=1&zoom=1&edge=curl&source=gbs_api,http://books.google.com/books?id=JXEIDAAAQBAJ&printsec=frontcover&dq=isbn:9781101935217&hl=&cd=1&source=gbs_api,the red balloon
9.78E+12,Angelina Ice Skates,Penguin,9/6/07,"Illus. in full color. To keep a couple of bullies from ruining their New Year's ice skating ballet, Angelina and her friends invite them to become part of the event. Working together, they create a celebration that is a tremendous success.",32,Juvenile Fiction,4,3,US,US,http://books.google.com/books/content?id=BmdFCQAAQBAJ&printsec=frontcover&img=1&zoom=1&edge=curl&source=gbs_api,http://books.google.com/books?id=BmdFCQAAQBAJ&printsec=frontcover&dq=isbn:9781101997581&hl=&cd=1&source=gbs_api,angelina ice skates
9.78E+12,Make Way for Ducklings,Penguin,2016-03,Mr. and Mrs. Mallard proudly return to their home in the Boston Public Garden with their eight offspring.,68,Juvenile Fiction,4,75,US,US,http://books.google.com/books/content?id=e5htDQAAQBAJ&printsec=frontcover&img=1&zoom=1&edge=curl&source=gbs_api,http://books.google.com/books?id=e5htDQAAQBAJ&printsec=frontcover&dq=isbn:9781101997956&hl=&cd=1&source=gbs_api,make way for ducklings
9.78E+12,Guess How Much I Love You,NA,1/1/15,"Sometimes, when you love someone very, very much, you want to find a way of describing how much you treasure them. But, as Little Nutbrown Hare and Big Nutbrown Hare discover, love is not always an easy thing to measure. Now new and exisiting fans can relive this cherished classic with this lavish edition, celebrating two decades of delighting readers since its initial creation.",32,NA,4,41,US,US,http://books.google.com/books/content?id=HJrboQEACAAJ&printsec=frontcover&img=1&zoom=1&source=gbs_api,http://books.google.com/books?id=HJrboQEACAAJ&dq=isbn:9781406358902&hl=&cd=1&source=gbs_api,guess how much i love you
9.78E+12,Giraffes Can't Dance 20th Anniversary Edition,Orchard Books,5/2/19,"Celebrate the 20th anniversary of much-loved picture book classic, Giraffes Can't Dance, with this special new edition and a super-shiny cover! Gerald the giraffe longs to go to the great Jungle Dance, but how can he join in when he doesn't know how to tango or two-step? Everyone knows that giraffes can't dance ... or can they? A funny, touching and triumphant story about being yourself and finding your own tune, Giraffes Can't Dance has been a family favourite for 20 years. ""All toddlers should grow up reading this"" Daily Mail ""A modern classic"" Baby & Me ""A joyful read about an outsider who finds acceptance on his own terms . . . there's also a simple moral about tolerance and daring to be different"" Junior ""A fantastically funny and wonderfully colourful romp"" Daily Telegraph",32,NA,NA,NA,US,US,http://books.google.com/books/content?id=h4vktgEACAAJ&printsec=frontcover&img=1&zoom=1&source=gbs_api,http://books.google.com/books?id=h4vktgEACAAJ&dq=isbn:9781408354414&hl=&cd=1&source=gbs_api,giraffes can't dance
9.78E+12,The Pout-Pout Fish,"Farrar, Straus and Giroux (BYR)",3/18/08,"A NEW YORK TIMES BEST SELLER Deep in the water, Mr. Fish swims about With his fish face stuck In a permanent pout. Can his pals cheer him up? Will his pout ever end? Is there something he can learn From an unexpected friend? Swim along with the pout-pout fish as he discovers that being glum and spreading ""dreary wearies"" isn't really his destiny. Bright ocean colors and playful rhyme come together in this fun fish story that's sure to turn even the poutiest of frowns upside down.The Pout-Pout Fish is a 2009 Bank Street - Best Children's Book of the Year.",32,Juvenile Fiction,4,6,US,US,http://books.google.com/books/content?id=00gTAgAAQBAJ&printsec=frontcover&img=1&zoom=1&edge=curl&source=gbs_api,http://books.google.com/books?id=00gTAgAAQBAJ&printsec=frontcover&dq=isbn:9781429916332&hl=&cd=1&source=gbs_api,the pout-pout fish
9.78E+12,"Arnie, the Doughnut",Henry Holt and Company (BYR),4/1/03,"A deliciously imaginative story about friendship_æ”from the author / illustrator of The Scrambled States of America. Arnie was fascinated as he watched the customers stream into the bakery. One by one, doughnuts were chosen, placed in paper bags, and whisked away with their new owners. Some went by the dozen in giant boxes. ""Good-bye!"" Arnie yelled to each doughnut. ""Have a good trip!"" ""This is so exciting!"" Arnie beamed. ""I wonder who will choose ME?"" At first glance, Arnie looks like an average doughnut_æ”round, cakey, with a hole in the middle, iced and sprinkled. He was made by one of the best bakeries in town, and admittedly his sprinkles are candy-colored. Still, a doughnut is just a doughnut, right? WRONG! Not if Arnie has anything to say about it. And, for a doughnut, he sure seems to have an awful lot to say. Can Arnie change the fate of all doughnuts_æ”or at least have a hand in his own future? Well, you'll just have to read this funny story and find out for yourself. This title has Common Core connections Arnie, the Doughnut is a 2004 Bank Street - Best Children's Book of the Year.",40,Juvenile Fiction,3.5,6,US,US,http://books.google.com/books/content?id=zQzOXLGijlwC&printsec=frontcover&img=1&zoom=1&edge=curl&source=gbs_api,http://books.google.com/books?id=zQzOXLGijlwC&printsec=frontcover&dq=isbn:9781429940016&hl=&cd=1&source=gbs_api,arnie the doughnut
9.78E+12,Arthur's Nose,Paw Prints,7/10/09,A young aardvark who is ashamed of his nose decides to go to the doctor to change his appearance,NA,NA,3.5,4,US,US,http://books.google.com/books/content?id=3Er5PgAACAAJ&printsec=frontcover&img=1&zoom=1&source=gbs_api,http://books.google.com/books?id=3Er5PgAACAAJ&dq=isbn:9781442046061&hl=&cd=1&source=gbs_api,arthur's nose
9.78E+12,Lost and Found,Simon and Schuster,4/17/12,"As two clever boys exploit a clerical oversight, each one discovers new perspectives on selfhood, friendship, and honesty. Identical twins Ray and Jay Grayson are moving to a new town. Again. But at least they_æ_ll have each other_æ_s company at their new school. Except, on the first day of sixth grade, Ray stays home sick, and Jay quickly discovers a major mistake: No one knows about his brother. Ray_æ_s not on the attendance lists and doesn_æ_t have a locker, or even a student folder. Jay decides that this lost information could be very_æ_useful. And fun. Maybe even a little dangerous.",192,Juvenile Fiction,4,24,US,US,http://books.google.com/books/content?id=SiOcAnChztoC&printsec=frontcover&img=1&zoom=1&edge=curl&source=gbs_api,http://books.google.com/books?id=SiOcAnChztoC&printsec=frontcover&dq=isbn:9781442406155&hl=&cd=1&source=gbs_api,lost and found
9.78E+12,"Good Dog, Carl",Simon & Schuster Books For Young Readers,8/31/10,Lively and unusual things happen when Carl the dog is left in charge of the baby.,40,Juvenile Fiction,4.5,33,US,US,http://books.google.com/books/content?id=1MK7RwAACAAJ&printsec=frontcover&img=1&zoom=1&source=gbs_api,http://books.google.com/books?id=1MK7RwAACAAJ&dq=isbn:9781442416604&hl=&cd=1&source=gbs_api,"good dog, carl"
9.78E+12,"Chicka Chicka 1, 2, 3",Simon and Schuster,11/23/10,"1 told 2 and 2 told 3, ""I'll race you to the top of the apple tree."" One hundred and one numbers climb the apple tree in this bright, rollicking, joyous book for young children. As the numerals pile up and bumblebees threaten, what's the number that saves the day? (Hint: It rhymes with ""hero."") Read and count and play and laugh to learn the surprising answer.",40,Juvenile Fiction,4,27,US,US,http://books.google.com/books/content?id=ttVVyAdK7l4C&printsec=frontcover&img=1&zoom=1&edge=curl&source=gbs_api,http://books.google.com/books?id=ttVVyAdK7l4C&printsec=frontcover&dq=isbn:9781442424159&hl=&cd=1&source=gbs_api,chicka chicka 1-2-3
9.78E+12,The Keeping Quilt,Simon and Schuster,11/15/11,"A homemade quilt ties together the lives of six generations of the author's immigrant Jewish family, remaining a symbol of their enduring love and faith.",32,Juvenile Fiction,4,39,US,US,http://books.google.com/books/content?id=91bjvI3jmAUC&printsec=frontcover&img=1&zoom=1&edge=curl&source=gbs_api,http://books.google.com/books?id=91bjvI3jmAUC&printsec=frontcover&dq=isbn:9781442449824&hl=&cd=1&source=gbs_api,the keeping quilt
9.78E+12,"Alexander and the Terrible, Horrible, No Good, Very Bad Day",Simon and Schuster,4/24/12,"He could tell it was going to be a terrible, horrible, no good, very bad day. He went to sleep with gum in his mouth and woke up with gum in his hair. When he got out of bed, he tripped over his skateboard and by mistake dropped his sweater in the sink while the water was running. He could tell it was going to be a terrible, horrible, no good, very bad day. It was a terrible, horrible, no good, very bad day. Nothing at all was right. Everything went wrong, right down to lima beans for supper and kissing on TV. What do you do on a day like that? Well, you may think about going to Australia. You may also be glad to find that some days are like that for other people too.",32,Juvenile Fiction,4,187,US,US,http://books.google.com/books/content?id=AGXinn6juRMC&printsec=frontcover&img=1&zoom=1&edge=curl&source=gbs_api,http://books.google.com/books?id=AGXinn6juRMC&printsec=frontcover&dq=isbn:9781442463165&hl=&cd=1&source=gbs_api,"alexander and the terrible, horrible, no good, very bad day"
9.78E+12,Today I'll Be a Princess,Andrews McMeel Publishing,2/3/15,"Every little girl wants to be a princess, and every mom knows that the grass isn't always greener on the other side of the castle walls. With its colorful pictures, Today I'll Be a Princess will make both sides happy, encouraging hours of imaginative play. Our heroine imagines all sorts of advantages to being a princess, until she learns that princesses don't get to play in the mud. It's no contest, and the tiara is abandoned in favor of playtime outside.",12,Juvenile Fiction,NA,NA,US,US,http://books.google.com/books/content?id=8h0CBQAAQBAJ&printsec=frontcover&img=1&zoom=1&edge=curl&source=gbs_api,http://books.google.com/books?id=8h0CBQAAQBAJ&printsec=frontcover&dq=isbn:9781449462864&hl=&cd=1&source=gbs_api,today i'll be a princess
9.78E+12,I Wish You More,Chronicle Books,3/31/15,"Some books are about a single wish. Some books are about three wishes. The infallible team of Amy Krouse Rosenthal and Tom Lichtenheld have combined their extraordinary talents to create this exuberant book of endless good wishes. Wishes for curiosity and wonder, for friendship and strength, laughter and peace. Whether celebrating life's joyous milestones, sharing words of encouragement, or observing the wonder of everyday moments, this sweet and uplifting book is perfect for wishers of every age. Plus, this is the fixed format version, which will look almost identical to the print version.",40,Juvenile Fiction,4.5,4,US,US,http://books.google.com/books/content?id=oOBwBgAAQBAJ&printsec=frontcover&img=1&zoom=1&edge=curl&source=gbs_api,http://books.google.com/books?id=oOBwBgAAQBAJ&printsec=frontcover&dq=isbn:9781452150376&hl=&cd=1&source=gbs_api,i wish you more
9.78E+12,Brave Irene,"Farrar, Straus and Giroux (BYR)",7/30/13,"Brave Irene is Irene Bobbin, the dressmaker's daughter. Her mother, Mrs. Bobbin, isn't feeling so well and can't possibly deliver the beautiful ball gown she's made for the duchess to wear that very evening. So plucky Irene volunteers to get the gown to the palace on time, in spite of the fierce snowstorm that's brewing-- quite an errand for a little girl. But where there's a will, there's a way, as Irene proves in the danger-fraught adventure that follows. She must defy the wiles of the wicked wind, her most formidable opponent, and overcome many obstacles before she completes her mission. Surely, this winning heroine will inspire every child to cheer her on. William Steig's Brave Irene is a 1986 New York Times Book Review Best Illustrated Book of the Year. NARRATED by MERYL STREEP.",32,Juvenile Fiction,3.5,18,US,US,http://books.google.com/books/content?id=bUsTAgAAQBAJ&printsec=frontcover&img=1&zoom=1&edge=curl&source=gbs_api,http://books.google.com/books?id=bUsTAgAAQBAJ&printsec=frontcover&dq=isbn:9781466808485&hl=&cd=1&source=gbs_api,brave irene
9.78E+12,MVP,Simon and Schuster,5/8/18,"From New York Times bestselling author and ESPN Television personality Mike Greenberg, host of the new morning talk show Get Up, and his wife Stacy comes a heartwarming, silly tale about a dog and her human pal. And all the authors_æ_ proceeds from this book are going to combat pediatric cancer! Phoebe is a dog with a pink tail. She lives with her family_æ”the Man in the Box, the Lady who Feeds Her, the Baby, and her sister the Girl with Curly Hair. Phoebe_æ_s favorite time of day is when she and her sister go to the park and play. But today things are a different. Can Phoebe convince her best friend to try something new? And can she show her that sometimes it_æ_s okay not to be perfect? Phoebe and her sister learn that no matter what happens and no matter how many mistakes you make, your family will always be there for you. In 2013, Mike and Stacy created the Heidi_æ_s Angels Foundation to fund cancer research. The authors will donate their proceeds from this book to Heidi_æ_s Angels, to help fight pediatric cancer through its support of the V Foundation for Cancer Research.",32,Juvenile Fiction,NA,NA,US,US,http://books.google.com/books/content?id=iGBEDwAAQBAJ&printsec=frontcover&img=1&zoom=1&edge=curl&source=gbs_api,http://books.google.com/books?id=iGBEDwAAQBAJ&printsec=frontcover&dq=isbn:9781481489324&hl=&cd=1&source=gbs_api,mvp: most valuable puppy
9.78E+12,The Gruffalo's Child,Pan Macmillan,4/21/16,"""The Gruffalo said that no gruffalo shouldEver set foot in the deep dark wood.""But one wild and windy night the Gruffalo's child disobeys her father's warnings and ventures out into the snow. After all, the Big Bad Mouse doesn't really exist . . . does he?The Gruffalo's Child is the Number One best-selling, much-loved sequel to the worldwide picture-book phenomenon that is The Gruffalo. Julia Donaldson's trademark rhyming text and Axel Scheffler's brilliant, characterful illustrations combine once more to ensure that the Gruffalo's Child has followed firmly in her father's footsteps and that her story is one that children will ask for again, and again... and again! This edition features the classic story with a stunning redesigned cover and beautiful finish, making it a must-have addition to the bookshelves of all Donaldson and Scheffler fans - big and small!Also available with redesigned covers are The Gruffalo, Room on the Broom, The Snail and the Whale, The Smartest Giant in Town, Monkey Puzzle, Charlie Cook's Favourite Book, and A Squash and a Squeeze.",32,NA,3.5,9,US,US,http://books.google.com/books/content?id=JEvFDAAAQBAJ&printsec=frontcover&img=1&zoom=1&source=gbs_api,http://books.google.com/books?id=JEvFDAAAQBAJ&dq=isbn:9781509804764&hl=&cd=1&source=gbs_api,the gruffalo's child
9.78E+12,Ten Little Ladybugs,Intervisual/Piggy Toes,6/1/07,"In Ten Little Ladybugs, one by one, ten tactile bugs disappear. Where did they all go? Young ones will love finding this out as they feel their way through the sturdy, colorful pages of this innovative book. The cute critters provide a hands-on learning experience and the rhyming text reinforces the counting concept. Interactive, educational, adorable - this magical countdown book adds up to a whole lot of fun. See why over 800,000 have been sold to date!",22,Juvenile Fiction,5,12,US,US,http://books.google.com/books/content?id=dus-GgAACAAJ&printsec=frontcover&img=1&zoom=1&source=gbs_api,http://books.google.com/books?id=dus-GgAACAAJ&dq=isbn:9781581175783&hl=&cd=1&source=gbs_api,ten little ladybugs
9.78E+12,Big Red Barn,Harper Collins,4/4/89,"By the big red barn In the great green field, There was a pink pig Who was learning to squeal. There were horses and sheep and goats and geese -- and a jaunty old scarecrow leaning on his hoe. And they all lived together by the big red barn. In joyous and exuberant Pictures, Felicia Bond lovingly evokes Margaret Wise Brown's simple, rhythmic text about the cycle of a day on a farm, where a family of animals peacefully plays and sleeps. There were horses and sheep and goats and geese -- and a jaunty old scarecrow leaning on his hoe. And they all lived together by the big red barn. In joyous and exuberant pictures, Felicia Bond lovingly evokes Margarett Wise Brown's simple, rhythmic text about the cycle of a day on a farm, where a family of animals peacefully plays and sleeps. ""Brown's melodic text is beguiling, while its subject'the big red barn that houses a menagerie of animals and their offspring'will have instant appeal to young children. Bond's newly added drawings have a simplicity that suits the story [about the cycle of a day on a farm]. A welcome reprise."" 'BL.",32,Juvenile Fiction,4.5,5,US,US,http://books.google.com/books/content?id=fNydlVCw040C&printsec=frontcover&img=1&zoom=1&edge=curl&source=gbs_api,http://books.google.com/books?id=fNydlVCw040C&printsec=frontcover&dq=isbn:9780060207489&hl=&cd=1&source=gbs_api,big red barn
9.78E+12,The Carrot Seed 60th Anniversary Edition,Harper Collins,5/23/45,"When a little boy plants a carrot seed, everyone tells him it won't grow. But when you are very young, there are some things that you just know, and the little boy knows that one day a carrot will come up. So he waters his seed, and pulls the weeds, and he waits ... First published in 1945 and never out of print, this timeless combination of Ruth Krauss's simple text and Crockett Johnson's eloquent illustrations creates a triumphant and deeply satisfying story for readers of all ages.",32,Juvenile Fiction,3.5,13,US,US,http://books.google.com/books/content?id=PFvBvtifZrwC&printsec=frontcover&img=1&zoom=1&edge=curl&source=gbs_api,http://books.google.com/books?id=PFvBvtifZrwC&printsec=frontcover&dq=isbn:9780060233501&hl=&cd=1&source=gbs_api,the carrot seed
