isbn,title,publisher,published_date,publisher_desription,n_pages,category,mean_rating,num_ratings,sale_country,access_country,cover_thumbnail_url,preview_url,title_us
9.78E+12,Grumpy Bird,Scholastic Press,3/29/16,"Bird wakes up feeling grumpy. Too grumpy to eat or play. Too grumpy even to fly. ""Looks like I'm walking today,"" says Bird. He walks past Sheep, who offers to keep him company. He walks past Rabbit, who also could use a walk. Raccoon, Beaver, and Fox join in, too. All the while, Bird grows grumpier and grumpier! But before he knows it, a little exercise and companionship help Bird overcome his bad mood. This winsome, refreshingly original story is sure to help kids (and grown-ups) giggle away theirs, too! Safe for all ages.",30,NA,4,24,US,US,http://books.google.com/books/content?id=e4QojgEACAAJ&printsec=frontcover&img=1&zoom=1&source=gbs_api,http://books.google.com/books?id=e4QojgEACAAJ&dq=isbn:9780545871822&hl=&cd=1&source=gbs_api,grumpy bird
9.78E+12,"Hand, Hand, Fingers, Thumb",Random House Books for Young Readers,1998-01,"Easy-to-read rhyming text describes what can be done on a drum with hand, fingers, and thumb. On board pages.",24,Juvenile Fiction,4.5,29,US,US,http://books.google.com/books/content?id=haYVAQAACAAJ&printsec=frontcover&img=1&zoom=1&source=gbs_api,http://books.google.com/books?id=haYVAQAACAAJ&dq=isbn:9780679890485&hl=&cd=1&source=gbs_api,"hand, hand, fingers, thumb"
9.78E+12,Harry the Dirty Dog,Harper Collins,10/6/76,"Harry is a white dog with black spots who loves everything . . . except baths. So one day before bath time, Harry runs away. He plays outside all day long, digging and sliding in everything from garden soil to pavement tar. By the time he returns home, Harry is so dirty he looks like a black dog with white spots. His family doesn't even recognize him!",32,Juvenile Fiction,4,59,US,US,http://books.google.com/books/content?id=vya5tsyYAxoC&printsec=frontcover&img=1&zoom=1&edge=curl&source=gbs_api,http://books.google.com/books?id=vya5tsyYAxoC&printsec=frontcover&dq=isbn:9780064430098&hl=&cd=1&source=gbs_api,harry the dirty dog
9.78E+12,"Hello, Rock",Purple House Press,9/10/12,A young boy dreams about all the things he could do with a rock he finds in his backyard.,28,Juvenile Fiction,NA,NA,US,US,http://books.google.com/books/content?id=0DrRMAEACAAJ&printsec=frontcover&img=1&zoom=1&source=gbs_api,http://books.google.com/books?id=0DrRMAEACAAJ&dq=isbn:9781930900646&hl=&cd=1&source=gbs_api,"hello, rock"
9.78E+12,Hippos Go Berserk,NA,5/1/00,Larger and larger groups of hippos join a lone hippopotamus for a party. On board pages.,16,Juvenile Nonfiction,4.5,15,US,US,http://books.google.com/books/content?id=MppDnwEACAAJ&printsec=frontcover&img=1&zoom=1&source=gbs_api,http://books.google.com/books?id=MppDnwEACAAJ&dq=isbn:9780689834349&hl=&cd=1&source=gbs_api,hippos go berserk
9.78E+12,How Do Dinosaurs Say Good Night?,Scholastic Inc.,2000,"In each playful spread of this read-aloud bedtime book, parents are ready to put their kids to bed&mdashbut these youngsters just happen to be dinosaurs!",32,Juvenile Fiction,4,48,US,US,http://books.google.com/books/content?id=nS3F-1HvciIC&printsec=frontcover&img=1&zoom=1&edge=curl&source=gbs_api,http://books.google.com/books?id=nS3F-1HvciIC&printsec=frontcover&dq=isbn:9780590316811&hl=&cd=1&source=gbs_api,how do dinosaurs say good night?
9.78E+12,I Want My Hat Back,Candlewick Press,2011,"A bear almost gives up his search for his missing hat until he remembers something important, in a cumulative tale with a mischievous twist.",40,Juvenile Fiction,4,1285,US,US,http://books.google.com/books/content?id=ma-TvidryY8C&printsec=frontcover&img=1&zoom=1&edge=curl&source=gbs_api,http://books.google.com/books?id=ma-TvidryY8C&printsec=frontcover&dq=isbn:9780763655983&hl=&cd=1&source=gbs_api,i want my hat back
9.78E+12,In the Night Kitchen,Harper Collins,1/18/96,"1971 Caldecott Honor Book Notable Children's Books of 1940--1970 (ALA) Best Books of 1970 (SLJ) Outstanding Children's Books of 1970 (NYT) Best Illustrated Children's Books of 1970 (NYT) Children's Books of 1970 (Library of Congress) Carey-Thomas Award 1971--Honor Citation Brooklyn Art Books for Children 1973, 1975",40,Juvenile Fiction,3.5,49,US,US,http://books.google.com/books/content?id=7GjYVXkWMVgC&printsec=frontcover&img=1&zoom=1&edge=curl&source=gbs_api,http://books.google.com/books?id=7GjYVXkWMVgC&printsec=frontcover&dq=isbn:9780064434362&hl=&cd=1&source=gbs_api,in the night kitchen
9.78E+12,Jenny and the Cat Club,New York Review of Books,2003,"Jenny Linsky, a black cat who lives with Captain Tinker in New York City, has adventures with the neighborhood cats who belong to the Cat Club.",160,Juvenile Fiction,4,13,US,US,http://books.google.com/books/content?id=dWtyAwAAQBAJ&printsec=frontcover&img=1&zoom=1&edge=curl&source=gbs_api,http://books.google.com/books?id=dWtyAwAAQBAJ&printsec=frontcover&dq=isbn:9781590170472&hl=&cd=1&source=gbs_api,jenny and the cat club
9.78E+12,Just Me and My Dad,Random House Books for Young Readers,1977,"Father and son go camping, but who is really taking care of whom?",24,Juvenile Fiction,4,23,US,US,http://books.google.com/books/content?id=zrjRtjHwWXgC&printsec=frontcover&img=1&zoom=1&edge=curl&source=gbs_api,http://books.google.com/books?id=zrjRtjHwWXgC&printsec=frontcover&dq=isbn:9780307118394&hl=&cd=1&source=gbs_api,just me and my dad
9.78E+12,Little Owl's Night,Viking,2013,"Little Owl enjoys a lovely night in the forest visiting his friend the raccoon, listening to the frogs croak and the crickets chirp, and watching the fog that hovers overhead.",34,Juvenile Fiction,4,16,US,US,http://books.google.com/books/content?id=GfFvDwAAQBAJ&printsec=frontcover&img=1&zoom=1&edge=curl&source=gbs_api,http://books.google.com/books?id=GfFvDwAAQBAJ&printsec=frontcover&dq=isbn:9780670015795&hl=&cd=1&source=gbs_api,little owl's night
9.78E+12,Llama Llama Home with Mama,Viking Juvenile,2011,"Llama Llama's mother takes good care of him when he has to stay home from school because he is sick, but when Mama Llama begins to feel sick, too, Llama Llama knows how to take care of her. Full color.",40,Juvenile Fiction,4.5,12,US,US,http://books.google.com/books/content?id=kVTRngEACAAJ&printsec=frontcover&img=1&zoom=1&source=gbs_api,http://books.google.com/books?id=kVTRngEACAAJ&dq=isbn:9780670012329&hl=&cd=1&source=gbs_api,llama llama home with mama
9.78E+12,Llama Llama Nighty-night,Penguin,2012,A young llama follows the same bedtime routine every night.,14,Juvenile Fiction,4.5,2,US,US,http://books.google.com/books/content?id=yXwODAAAQBAJ&printsec=frontcover&img=1&zoom=1&edge=curl&source=gbs_api,http://books.google.com/books?id=yXwODAAAQBAJ&printsec=frontcover&dq=isbn:9780670013272&hl=&cd=1&source=gbs_api,llama llama nighty-night
9.78E+12,Love You Forever,Firefly Books,1986,"As her son grows up from little boy to adult man, a mother secretly rocks him each night as he sleeps.",32,Juvenile Fiction,4.5,342,US,US,http://books.google.com/books/content?id=7ep09WAFbDwC&printsec=frontcover&img=1&zoom=1&edge=curl&source=gbs_api,http://books.google.com/books?id=7ep09WAFbDwC&printsec=frontcover&dq=isbn:9780920668375&hl=&cd=1&source=gbs_api,love you forever
9.78E+12,Madeline,Viking Juvenile,1967,"Madeline, smallest and naughtiest of the twelve little charges of Miss Clavel, wakes up one night with an attack of appendicitis.",48,Juvenile Fiction,4,75,US,US,http://books.google.com/books/content?id=uH1FnwEACAAJ&printsec=frontcover&img=1&zoom=1&source=gbs_api,http://books.google.com/books?id=uH1FnwEACAAJ&dq=isbn:9780670445806&hl=&cd=1&source=gbs_api,madeline
9.78E+12,Maisy Goes Camping,Candlewick Press (MA),2009-03,Maisy the mouse and her friends spend a night camping under the stars.,32,Juvenile Fiction,4,4,US,US,http://books.google.com/books/content?id=dX-pOwAACAAJ&printsec=frontcover&img=1&zoom=1&source=gbs_api,http://books.google.com/books?id=dX-pOwAACAAJ&dq=isbn:9780763643683&hl=&cd=1&source=gbs_api,maisy goes camping
9.78E+12,Maisy Goes to the Library,Candlewick Press,2009,Maisy goes to the library in search of a book about fish and a quiet place in which to read it.,32,Juvenile Fiction,4,6,US,US,http://books.google.com/books/content?id=q_mNYe-kM3EC&printsec=frontcover&img=1&zoom=1&edge=curl&source=gbs_api,http://books.google.com/books?id=q_mNYe-kM3EC&printsec=frontcover&dq=isbn:9780763643713&hl=&cd=1&source=gbs_api,maisy goes to the library
9.78E+12,Mighty Monster Machines (Blaze and the Monster Machines),Golden Books,2015,"""Based on the teleplay ""Blaze of glory"" by Clark Stubbs.""",24,Juvenile Fiction,NA,NA,US,US,http://books.google.com/books/content?id=HrPZCwAAQBAJ&printsec=frontcover&img=1&zoom=1&edge=curl&source=gbs_api,http://books.google.com/books?id=HrPZCwAAQBAJ&printsec=frontcover&dq=isbn:9780553524567&hl=&cd=1&source=gbs_api,mighty monster machines (blaze and the monster machines)
9.78E+12,Mike Mulligan and His Steam Shovel,Houghton Mifflin Harcourt,1967,"Threatened by competition from modern shovels, Mike proves the worth of his trusty old steam shovel, Mary Anne.",48,JUVENILE FICTION,4,30,US,US,http://books.google.com/books/content?id=yWnDLd9YDEQC&printsec=frontcover&img=1&zoom=1&source=gbs_api,http://books.google.com/books?id=yWnDLd9YDEQC&pg=PP1&dq=isbn:9780395259399&hl=&cd=1&source=gbs_api,mike mulligan and his steam shovel
9.78E+12,Millions of Cats,Penguin,2006,How can an old man and his wife select one cat from a choice of millions and trillions?,32,Juvenile Fiction,4,40,US,US,http://books.google.com/books/content?id=ml8lDwAAQBAJ&printsec=frontcover&img=1&zoom=1&edge=curl&source=gbs_api,http://books.google.com/books?id=ml8lDwAAQBAJ&printsec=frontcover&dq=isbn:9780142407080&hl=&cd=1&source=gbs_api,millions of cats
9.78E+12,Miss Rumphius,Penguin,1985,"Seeking adventure in faraway places, Miss Rumphius fulfills her dream and then sets out to make the world more beautiful.",32,Juvenile Fiction,4,62,US,US,http://books.google.com/books/content?id=NKmLDQAAQBAJ&printsec=frontcover&img=1&zoom=1&edge=curl&source=gbs_api,http://books.google.com/books?id=NKmLDQAAQBAJ&printsec=frontcover&dq=isbn:9780140505399&hl=&cd=1&source=gbs_api,miss rumphius
9.78E+12,Mortimer,NA,1985,"After attempts by his mother, his father, his brothers and sisters, and even two policemen, Mortimer finally goes to sleep.",24,Juvenile Fiction,4,9,US,US,http://books.google.com/books/content?id=6aZlRbyDGYsC&printsec=frontcover&img=1&zoom=1&source=gbs_api,http://books.google.com/books?id=6aZlRbyDGYsC&dq=isbn:9780920303115&hl=&cd=1&source=gbs_api,mortimer
9.78E+12,Mr. Brown Can Moo! Can You?,Random House Books for Young Readers,1996,Mr. Brown is an expert at imitating all sorts of noises.,24,Juvenile Fiction,4,61,US,US,http://books.google.com/books/content?id=VsA3fMzENEIC&printsec=frontcover&img=1&zoom=1&edge=curl&source=gbs_api,http://books.google.com/books?id=VsA3fMzENEIC&printsec=frontcover&dq=isbn:9780679882824&hl=&cd=1&source=gbs_api,mr. brown can moo! can you?
9.78E+12,"Night-Night, Little Pookie",Little Simon,8/29/17,"Get ready for bed with a little Pookie flair in this slumber time board book from the beloved and bestselling Sandra Boynton. Oh, Pooooooo-kie! It_æ_s time for bed, now. Come out, Little Pookie. Oh, where can you be? It may be bedtime, but Pookie still has a whole night-night routine to finish: picking out pajamas, brushing teeth, washing up, and a little hide-and-seek. With Sandra Boynton_æ_s signature charm and piggy pizzazz, this not-quite-ready-for-bed story proves that every Little Pookie loves a good night_æ_s sleep.",18,Juvenile Fiction,NA,NA,US,US,http://books.google.com/books/content?id=cCg4MQAACAAJ&printsec=frontcover&img=1&zoom=1&source=gbs_api,http://books.google.com/books?id=cCg4MQAACAAJ&dq=isbn:9781481497718&hl=&cd=1&source=gbs_api,"night-night, little pookie"
9.78E+12,Olivia,Atheneum Books for Young Readers,10/1/04,It's everyone's favorite pig...it's OLIVIA! The Caldecott Honor Book and New York Times #1 bestseller is now available in a sturdy format perfect for pig-loving toddlers everywhere!,34,Juvenile Fiction,4,107,US,US,http://books.google.com/books/content?id=_zTvOgAACAAJ&printsec=frontcover&img=1&zoom=1&source=gbs_api,http://books.google.com/books?id=_zTvOgAACAAJ&dq=isbn:9780689874727&hl=&cd=1&source=gbs_api,olivia
9.78E+12,On the Night You Were Born,Feiwel & Friends,1/19/10,"On the night you were born, you brought wonder and magic to the world. The moon stayed up till morning. Polar bears danced. Here is a book that celebrates the one and only ever you! Now available in its entirety in board book format, Nancy Tillman_æ_s masterpiece is perfect for acknowledging the special people in our lives that they are loved.",32,Juvenile Fiction,4.5,197,US,US,http://books.google.com/books/content?id=LwDDQQAACAAJ&printsec=frontcover&img=1&zoom=1&source=gbs_api,http://books.google.com/books?id=LwDDQQAACAAJ&dq=isbn:9780312601553&hl=&cd=1&source=gbs_api,on the night you were born
9.78E+12,Owl Moon,Penguin,1987,"On a winter's night under a full moon, a father and daughter trek into the woods to see the Great Horned Owl.",32,Juvenile Fiction,4,97,US,US,http://books.google.com/books/content?id=TBUxDwAAQBAJ&printsec=frontcover&img=1&zoom=1&edge=curl&source=gbs_api,http://books.google.com/books?id=TBUxDwAAQBAJ&printsec=frontcover&dq=isbn:9780399214578&hl=&cd=1&source=gbs_api,owl moon
9.78E+12,P Is for Potty!,Random House Books for Young Readers,2014,"In this interactive book with lift flaps, Elmo helps his little cousin Albie learn to use the potty.",12,Juvenile Fiction,4,1,US,US,http://books.google.com/books/content?id=zvcBDAAAQBAJ&printsec=frontcover&img=1&zoom=1&edge=curl&source=gbs_api,http://books.google.com/books?id=zvcBDAAAQBAJ&printsec=frontcover&dq=isbn:9780385383691&hl=&cd=1&source=gbs_api,p is for potty!
9.78E+12,Pajama Time!,Workman Publishing,4/1/00,"Pajama Time! is a good-night book with the irrepressible language, the inimitable illustrations, the irresistible cast of characters only Sandra Boynton could create. A jump-roping chicken and a pig on a swing. A Scottie in plaid pajamas and an elephant in a fuzzy one-piece with feet. And in sing-along nuttiness reminiscent of Barnyard Dance!, it's time to head to bed-to the beat: Pajammy to the left. Pajammy to the right. Jamma jamma jamma jamma P!J! Everybody's wearing them for dancing tonight. Jamma jamma jamma jamma P!J! Oversized lap edition also available_æ”perfect for reading aloud!",24,Juvenile Fiction,3.5,14,US,US,http://books.google.com/books/content?id=nrhRCwAAQBAJ&printsec=frontcover&img=1&zoom=1&source=gbs_api,http://books.google.com/books?id=nrhRCwAAQBAJ&dq=isbn:9780761119753&hl=&cd=1&source=gbs_api,pajama time!
9.78E+12,Pat the Bunny,Golden Books,1968,"Gives children opportunities to touch a rabbit, smell flowers, look in a mirror, and participate in other activities enjoyed by Paul and Judy.",20,Juvenile Fiction,3.5,10,US,US,http://books.google.com/books/content?id=zlyHHvgCZpAC&printsec=frontcover&img=1&zoom=1&edge=curl&source=gbs_api,http://books.google.com/books?id=zlyHHvgCZpAC&printsec=frontcover&dq=isbn:9780307120007&hl=&cd=1&source=gbs_api,pat the bunny
9.78E+12,Pete the Cat: Rocking in My School Shoes,Harper Collins,7/26/11,"Pete the Cat is back_æ”and this time he_æ_s rocking in his school shoes. Pete discovers the library, the lunchroom, the playground, and lots of other cool places at school. And no matter where he goes, Pete never stops moving and grooving and singing his song . . . because it_æ_s all good.",40,Juvenile Fiction,4,25,US,US,http://books.google.com/books/content?id=t2KlwOaE6t0C&printsec=frontcover&img=1&zoom=1&edge=curl&source=gbs_api,http://books.google.com/books?id=t2KlwOaE6t0C&printsec=frontcover&dq=isbn:9780061910241&hl=&cd=1&source=gbs_api,pete the cat: rocking in my school shoes
9.78E+12,"Polar Bear, Polar Bear, What Do You Hear?",Macmillan,9/15/97,"Zoo animals from polar bear to walrus make their distinctive sounds for each other, while children imitate the sounds for the zookeeper. On board pages.",28,Juvenile Fiction,4,49,US,US,http://books.google.com/books/content?id=FNnMSZ6N7pAC&printsec=frontcover&img=1&zoom=1&edge=curl&source=gbs_api,http://books.google.com/books?id=FNnMSZ6N7pAC&printsec=frontcover&dq=isbn:9780805053883&hl=&cd=1&source=gbs_api,"polar bear, polar bear, what do you hear?"
9.78E+12,Potty,Candlewick Press,2010,"Baby, a toddler, decides to use the potty for the first time.",28,Juvenile Fiction,3.5,5,US,US,http://books.google.com/books/content?id=qRrbd_lxKp8C&printsec=frontcover&img=1&zoom=1&edge=curl&source=gbs_api,http://books.google.com/books?id=qRrbd_lxKp8C&printsec=frontcover&dq=isbn:9780763644765&hl=&cd=1&source=gbs_api,potty
9.78E+12,Press Here,Chronicle Books Llc,3/30/11,"Using no special effects other than the reader's imagination, a series of dots multiplies, grows, or changes color by pressing, tilting, or blowing on the previous page.",56,Juvenile Fiction,4.5,700,US,US,http://books.google.com/books/content?id=8nS1ngEACAAJ&printsec=frontcover&img=1&zoom=1&source=gbs_api,http://books.google.com/books?id=8nS1ngEACAAJ&dq=isbn:9780811879545&hl=&cd=1&source=gbs_api,press here
9.78E+12,Rain Makes Applesauce,NA,1/1/64,Delightful and imaginative nonsense talk is enhanced by equally nonsensical drawings,32,Juvenile Fiction,4.5,7,US,US,http://books.google.com/books/content?id=zXCqWYD3Rd0C&printsec=frontcover&img=1&zoom=1&source=gbs_api,http://books.google.com/books?id=zXCqWYD3Rd0C&dq=isbn:9780823400911&hl=&cd=1&source=gbs_api,rain makes applesauce
9.78E+12,"Sayonara, Mrs. Kackleman",Viking Books for Young Readers,1989,"Alexander and his older sister Lulu visit Japan and discover many fascinating things including fish markets, outdoor baths, futons, and a frog who writes haiku.",34,Juvenile Fiction,NA,NA,US,US,http://books.google.com/books/content?id=R5tmQgAACAAJ&printsec=frontcover&img=1&zoom=1&source=gbs_api,http://books.google.com/books?id=R5tmQgAACAAJ&dq=isbn:9780670829453&hl=&cd=1&source=gbs_api,"sayonara, mrs. kackleman"
9.78E+12,Slow Loris,Random House,2003,"""Slow Loris was a slow loris and he was very slow. He lived in a zoo. The visitors thought him boring. The other animals did too. 'It took Loris ten minutes to eat a satsuma . . . wenty minutes to get from one end of his branch to the other . . . nd an hour to scratch his bottom. But Slow Loris didn't care. He had a secret . . .",32,Children's stories,5,1,US,US,http://books.google.com/books/content?id=0raj3ARNhWAC&printsec=frontcover&img=1&zoom=1&source=gbs_api,http://books.google.com/books?id=0raj3ARNhWAC&dq=isbn:9780099414261&hl=&cd=1&source=gbs_api,slow loris
9.78E+12,Square,Candlewick Press,5/8/18,"When his friend Circle asks him to do her portrait after praising him as a sculptor and genius, Square struggles to carve her likeness from a stone block.",48,Juvenile Fiction,4,2,US,US,http://books.google.com/books/content?id=DbNDDwAAQBAJ&printsec=frontcover&img=1&zoom=1&edge=curl&source=gbs_api,http://books.google.com/books?id=DbNDDwAAQBAJ&printsec=frontcover&dq=isbn:9780763696078&hl=&cd=1&source=gbs_api,square
9.78E+12,Stellaluna,Houghton Mifflin Harcourt,1993,"After she falls headfirst into a bird's nest, a baby bat is raised like a bird until she is reunited with her mother.",48,Juvenile Fiction,4,72,US,US,http://books.google.com/books/content?id=hjiQoetvrAUC&printsec=frontcover&img=1&zoom=1&edge=curl&source=gbs_api,http://books.google.com/books?id=hjiQoetvrAUC&printsec=frontcover&dq=isbn:9780152802172&hl=&cd=1&source=gbs_api,stellaluna
9.78E+12,Sylvester and the Magic Pebble,Little Simon,3/6/12,"A cherished classic is brought to life with the audio stylings of renowned actor James Earl Jones. Sylvester can_æ_t believe his luck when he finds a magic pebble that can make wishes come true. But when a lion jumps out at him on his way home, Sylvester is shocked into making a wish that has unexpected consequences. After overcoming a series of obstacles, Sylvester is eventually reunited with his loving family. Illustrated with William Steig_æ_s glowing pictures, this winner of the Caldecott Medal is beloved by children everywhere. This package includes a paperback book along with a CD of this modern classic read by legendary actor James Earl Jones.",32,Juvenile Fiction,4,61,US,US,http://books.google.com/books/content?id=YCMxkgEACAAJ&printsec=frontcover&img=1&zoom=1&source=gbs_api,http://books.google.com/books?id=YCMxkgEACAAJ&dq=isbn:9781442435605&hl=&cd=1&source=gbs_api,sylvester and the magic pebble
9.78E+12,Ten Little Fingers and Ten Little Toes,Houghton Mifflin Harcourt,2010-08,"Rhyming text compares babies born in different places and in different circumstances, but they all share the commonality of ten little fingers and ten little toes. On board pages.",38,Juvenile Fiction,4,27,US,US,http://books.google.com/books/content?id=ANslQwAACAAJ&printsec=frontcover&img=1&zoom=1&source=gbs_api,http://books.google.com/books?id=ANslQwAACAAJ&dq=isbn:9780547366203&hl=&cd=1&source=gbs_api,ten little fingers and ten little toes
9.78E+12,That Is Not a Good Idea!,Balzer + Bray,4/23/13,"That Is Not a Good Idea! is a hilarious, interactive picture book from bestselling author and illustrator Mo Willems, the creator of books like Don_æ_t Let the Pigeon Drive the Bus, the Knuffle Bunny series, the Elephant and Piggie series, Goldilocks and the Three Dinosaurs, and many other new classics. Inspired by the evil villains and innocent damsels of silent movies, Willems tells the tale of a hungry fox who invites a plump goose to dinner. As with the beloved Pigeon books, kids will be calling out the signature refrain and begging for repeated readings. The funny details in the full-color illustrations by three-time Caldecott Honoree Mo Willems will bring nonstop laughter to story time.",48,Juvenile Fiction,NA,NA,US,US,http://books.google.com/books/content?id=VfJVuwEACAAJ&printsec=frontcover&img=1&zoom=1&source=gbs_api,http://books.google.com/books?id=VfJVuwEACAAJ&dq=isbn:9780062203090&hl=&cd=1&source=gbs_api,that is not a good idea!
9.78E+12,The Berenstain Bears and the Green-eyed Monster,Random House Books for Young Readers,1995-03,Sister is overcome with jealousy when Brother gets a shiny new ten-speed bike for his birthday.,32,Juvenile Fiction,4.5,2,US,US,http://books.google.com/books/content?id=6MN2DyzKdPEC&printsec=frontcover&img=1&zoom=1&edge=curl&source=gbs_api,http://books.google.com/books?id=6MN2DyzKdPEC&printsec=frontcover&dq=isbn:9780679864349&hl=&cd=1&source=gbs_api,the berenstain bears and the green-eyed monster
9.78E+12,The Big Honey Hunt,Random House Books for Young Readers,1962,Papa Bear tries to teach Small Bear how to find honey in a honey tree.,63,Juvenile Fiction,4,6,US,US,http://books.google.com/books/content?id=V3eLDQAAQBAJ&printsec=frontcover&img=1&zoom=1&edge=curl&source=gbs_api,http://books.google.com/books?id=V3eLDQAAQBAJ&printsec=frontcover&dq=isbn:9780394800288&hl=&cd=1&source=gbs_api,the big honey hunt
9.78E+12,The Cat in the Hat,Random House Childrens Books,1957,Two children sitting at home on a rainy day are visited by the Cat in the Hat who shows them some tricks and games.,61,Juvenile Fiction,4,3729,US,US,http://books.google.com/books/content?id=XPpZAAAAYAAJ&printsec=frontcover&img=1&zoom=1&source=gbs_api,http://books.google.com/books?id=XPpZAAAAYAAJ&dq=isbn:9780394800011&hl=&cd=1&source=gbs_api,the cat in the hat
9.78E+12,The Day the Crayons Quit,Penguin,2013,"When Duncan arrives at school one morning, he finds a stack of letters, one from each of his crayons, complaining about how he uses them. 75,000 first printing.",30,Juvenile Fiction,4.5,106,US,US,http://books.google.com/books/content?id=EC3eDAAAQBAJ&printsec=frontcover&img=1&zoom=1&edge=curl&source=gbs_api,http://books.google.com/books?id=EC3eDAAAQBAJ&printsec=frontcover&dq=isbn:9780399255373&hl=&cd=1&source=gbs_api,the day the crayons quit
9.78E+12,The Duckling Gets a Cookie!?,Hyperion,4/3/12,Pigeon is very angry when the duckling gets a cookie just by asking politely.,40,Juvenile Fiction,4,258,US,US,http://books.google.com/books/content?id=Pbc5nwEACAAJ&printsec=frontcover&img=1&zoom=1&source=gbs_api,http://books.google.com/books?id=Pbc5nwEACAAJ&dq=isbn:9781423151289&hl=&cd=1&source=gbs_api,the duckling gets a cookie!?
9.78E+12,The Fantastic Flying Books of Mr. Morris Lessmore,Simon and Schuster,6/19/12,"Morris Lessmore loves words, stories and books, and after a tornado carries him to another land, dreary and colorless, he finds a single book in color that leads him to an amazing library where, he learns, the books need him as much as he needs them.",56,Juvenile Fiction,4.5,71,US,US,http://books.google.com/books/content?id=pa4LUt0FCB0C&printsec=frontcover&img=1&zoom=1&edge=curl&source=gbs_api,http://books.google.com/books?id=pa4LUt0FCB0C&printsec=frontcover&dq=isbn:9781442457027&hl=&cd=1&source=gbs_api,the fantastic flying books of mr. morris lessmore
9.78E+12,The Foot Book,NA,1996,Beginner's text describes all sorts of feet doing all sorts of things.,27,Foot,4.5,36,US,US,http://books.google.com/books/content?id=OdJSSQAACAAJ&printsec=frontcover&img=1&zoom=1&source=gbs_api,http://books.google.com/books?id=OdJSSQAACAAJ&dq=isbn:9780375861352&hl=&cd=1&source=gbs_api,the foot book
9.78E+12,The Garden of Abdul Gasazi,Houghton Mifflin Harcourt,1979,"When the dog he is caring for runs away from Alan into the forbidden garden of a retired dog-hating magician, a spell seems to be cast over the contrary dog.",33,Juvenile Fiction,4,29,US,US,http://books.google.com/books/content?id=Jxo26aqVMHoC&printsec=frontcover&img=1&zoom=1&edge=curl&source=gbs_api,http://books.google.com/books?id=Jxo26aqVMHoC&printsec=frontcover&dq=isbn:9780395278048&hl=&cd=1&source=gbs_api,the garden of abdul gasazi
