book_id,title,publisher,publisher_desription,n_pages,google_mean_rating,google_num_ratings,cover_thumbnail_url,preview_url
M20,OWL MOON,Penguin,"On a winter's night under a full moon, a father and daughter trek into the woods to see the Great Horned Owl.",32,4,97,http://books.google.com/books/content?id=TBUxDwAAQBAJ&printsec=frontcover&img=1&zoom=1&edge=curl&source=gbs_api,http://books.google.com/books?id=TBUxDwAAQBAJ&printsec=frontcover&dq=isbn:9780399214578&hl=&cd=1&source=gbs_api
L178,P IS FOR POTTY!,Random House Books for Young Readers,"In this interactive book with lift flaps, Elmo helps his little cousin Albie learn to use the potty.",12,4,1,http://books.google.com/books/content?id=zvcBDAAAQBAJ&printsec=frontcover&img=1&zoom=1&edge=curl&source=gbs_api,http://books.google.com/books?id=zvcBDAAAQBAJ&printsec=frontcover&dq=isbn:9780385383691&hl=&cd=1&source=gbs_api
L125,PAJAMA TIME!,Workman Publishing,"Pajama Time! is a good-night book with the irrepressible language, the inimitable illustrations, the irresistible cast of characters only Sandra Boynton could create. A jump-roping chicken and a pig on a swing. A Scottie in plaid pajamas and an elephant in a fuzzy one-piece with feet. And in sing-along nuttiness reminiscent of Barnyard Dance!, it's time to head to bed-to the beat: Pajammy to the left. Pajammy to the right. Jamma jamma jamma jamma P!J! Everybody's wearing them for dancing tonight. Jamma jamma jamma jamma P!J! Oversized lap edition also available_Êîperfect for reading aloud!",24,3.5,14,http://books.google.com/books/content?id=nrhRCwAAQBAJ&printsec=frontcover&img=1&zoom=1&source=gbs_api,http://books.google.com/books?id=nrhRCwAAQBAJ&dq=isbn:9780761119753&hl=&cd=1&source=gbs_api
L180,PAT THE BUNNY,Golden Books,"Gives children opportunities to touch a rabbit, smell flowers, look in a mirror, and participate in other activities enjoyed by Paul and Judy.",20,3.5,10,http://books.google.com/books/content?id=zlyHHvgCZpAC&printsec=frontcover&img=1&zoom=1&edge=curl&source=gbs_api,http://books.google.com/books?id=zlyHHvgCZpAC&printsec=frontcover&dq=isbn:9780307120007&hl=&cd=1&source=gbs_api
L145,PETE THE CAT: ROCKING IN MY SCHOOL SHOES,Harper Collins,"Pete the Cat is back_Êîand this time he_Ê_s rocking in his school shoes. Pete discovers the library, the lunchroom, the playground, and lots of other cool places at school. And no matter where he goes, Pete never stops moving and grooving and singing his song . . . because it_Ê_s all good.",40,4,25,http://books.google.com/books/content?id=t2KlwOaE6t0C&printsec=frontcover&img=1&zoom=1&edge=curl&source=gbs_api,http://books.google.com/books?id=t2KlwOaE6t0C&printsec=frontcover&dq=isbn:9780061910241&hl=&cd=1&source=gbs_api
L190,"POLAR BEAR, POLAR BEAR, WHAT DO YOU HEAR?",Macmillan,"Zoo animals from polar bear to walrus make their distinctive sounds for each other, while children imitate the sounds for the zookeeper. On board pages.",28,4,49,http://books.google.com/books/content?id=FNnMSZ6N7pAC&printsec=frontcover&img=1&zoom=1&edge=curl&source=gbs_api,http://books.google.com/books?id=FNnMSZ6N7pAC&printsec=frontcover&dq=isbn:9780805053883&hl=&cd=1&source=gbs_api
L203,POTTY,Candlewick Press,"Baby, a toddler, decides to use the potty for the first time.",28,3.5,5,http://books.google.com/books/content?id=qRrbd_lxKp8C&printsec=frontcover&img=1&zoom=1&edge=curl&source=gbs_api,http://books.google.com/books?id=qRrbd_lxKp8C&printsec=frontcover&dq=isbn:9780763644765&hl=&cd=1&source=gbs_api
L246,PRESS HERE,Chronicle Books Llc,"Using no special effects other than the reader's imagination, a series of dots multiplies, grows, or changes color by pressing, tilting, or blowing on the previous page.",56,4.5,700,http://books.google.com/books/content?id=8nS1ngEACAAJ&printsec=frontcover&img=1&zoom=1&source=gbs_api,http://books.google.com/books?id=8nS1ngEACAAJ&dq=isbn:9780811879545&hl=&cd=1&source=gbs_api
L220,RAIN MAKES APPLESAUCE,NA,Delightful and imaginative nonsense talk is enhanced by equally nonsensical drawings,32,4.5,7,http://books.google.com/books/content?id=zXCqWYD3Rd0C&printsec=frontcover&img=1&zoom=1&source=gbs_api,http://books.google.com/books?id=zXCqWYD3Rd0C&dq=isbn:9780823400911&hl=&cd=1&source=gbs_api
L173,"SAYONARA, MRS. KACKLEMAN",Viking Books for Young Readers,"Alexander and his older sister Lulu visit Japan and discover many fascinating things including fish markets, outdoor baths, futons, and a frog who writes haiku.",34,NA,NA,http://books.google.com/books/content?id=R5tmQgAACAAJ&printsec=frontcover&img=1&zoom=1&source=gbs_api,http://books.google.com/books?id=R5tmQgAACAAJ&dq=isbn:9780670829453&hl=&cd=1&source=gbs_api
L144,SLOW LORIS,Random House,"""Slow Loris was a slow loris and he was very slow. He lived in a zoo. The visitors thought him boring. The other animals did too. 'It took Loris ten minutes to eat a satsuma . . . wenty minutes to get from one end of his branch to the other . . . nd an hour to scratch his bottom. But Slow Loris didn't care. He had a secret . . .",32,5,1,http://books.google.com/books/content?id=0raj3ARNhWAC&printsec=frontcover&img=1&zoom=1&source=gbs_api,http://books.google.com/books?id=0raj3ARNhWAC&dq=isbn:9780099414261&hl=&cd=1&source=gbs_api
L110,SQUARE,Candlewick Press,"When his friend Circle asks him to do her portrait after praising him as a sculptor and genius, Square struggles to carve her likeness from a stone block.",48,4,2,http://books.google.com/books/content?id=DbNDDwAAQBAJ&printsec=frontcover&img=1&zoom=1&edge=curl&source=gbs_api,http://books.google.com/books?id=DbNDDwAAQBAJ&printsec=frontcover&dq=isbn:9780763696078&hl=&cd=1&source=gbs_api
M21,STELLALUNA,Houghton Mifflin Harcourt,"After she falls headfirst into a bird's nest, a baby bat is raised like a bird until she is reunited with her mother.",48,4,72,http://books.google.com/books/content?id=hjiQoetvrAUC&printsec=frontcover&img=1&zoom=1&edge=curl&source=gbs_api,http://books.google.com/books?id=hjiQoetvrAUC&printsec=frontcover&dq=isbn:9780152802172&hl=&cd=1&source=gbs_api
M22,SYLVESTER AND THE MAGIC PEBBLE,Little Simon,"A cherished classic is brought to life with the audio stylings of renowned actor James Earl Jones. Sylvester can_Ê_t believe his luck when he finds a magic pebble that can make wishes come true. But when a lion jumps out at him on his way home, Sylvester is shocked into making a wish that has unexpected consequences. After overcoming a series of obstacles, Sylvester is eventually reunited with his loving family. Illustrated with William Steig_Ê_s glowing pictures, this winner of the Caldecott Medal is beloved by children everywhere. This package includes a paperback book along with a CD of this modern classic read by legendary actor James Earl Jones.",32,4,61,http://books.google.com/books/content?id=YCMxkgEACAAJ&printsec=frontcover&img=1&zoom=1&source=gbs_api,http://books.google.com/books?id=YCMxkgEACAAJ&dq=isbn:9781442435605&hl=&cd=1&source=gbs_api
L155,TEN LITTLE FINGERS AND TEN LITTLE TOES,Houghton Mifflin Harcourt,"Rhyming text compares babies born in different places and in different circumstances, but they all share the commonality of ten little fingers and ten little toes. On board pages.",38,4,27,http://books.google.com/books/content?id=ANslQwAACAAJ&printsec=frontcover&img=1&zoom=1&source=gbs_api,http://books.google.com/books?id=ANslQwAACAAJ&dq=isbn:9780547366203&hl=&cd=1&source=gbs_api
M86,THAT IS NOT A GOOD IDEA!,Balzer + Bray,"That Is Not a Good Idea! is a hilarious, interactive picture book from bestselling author and illustrator Mo Willems, the creator of books like Don_Ê_t Let the Pigeon Drive the Bus, the Knuffle Bunny series, the Elephant and Piggie series, Goldilocks and the Three Dinosaurs, and many other new classics. Inspired by the evil villains and innocent damsels of silent movies, Willems tells the tale of a hungry fox who invites a plump goose to dinner. As with the beloved Pigeon books, kids will be calling out the signature refrain and begging for repeated readings. The funny details in the full-color illustrations by three-time Caldecott Honoree Mo Willems will bring nonstop laughter to story time.",48,NA,NA,http://books.google.com/books/content?id=VfJVuwEACAAJ&printsec=frontcover&img=1&zoom=1&source=gbs_api,http://books.google.com/books?id=VfJVuwEACAAJ&dq=isbn:9780062203090&hl=&cd=1&source=gbs_api
M87,THE BERENSTAIN BEARS AND THE GREEN-EYED MONSTER,Random House Books for Young Readers,Sister is overcome with jealousy when Brother gets a shiny new ten-speed bike for his birthday.,32,4.5,2,http://books.google.com/books/content?id=6MN2DyzKdPEC&printsec=frontcover&img=1&zoom=1&edge=curl&source=gbs_api,http://books.google.com/books?id=6MN2DyzKdPEC&printsec=frontcover&dq=isbn:9780679864349&hl=&cd=1&source=gbs_api
L113,THE BIG HONEY HUNT,Random House Books for Young Readers,Papa Bear tries to teach Small Bear how to find honey in a honey tree.,63,4,6,http://books.google.com/books/content?id=V3eLDQAAQBAJ&printsec=frontcover&img=1&zoom=1&edge=curl&source=gbs_api,http://books.google.com/books?id=V3eLDQAAQBAJ&printsec=frontcover&dq=isbn:9780394800288&hl=&cd=1&source=gbs_api
M77,THE CAT IN THE HAT,Random House Childrens Books,Two children sitting at home on a rainy day are visited by the Cat in the Hat who shows them some tricks and games.,61,4,3729,http://books.google.com/books/content?id=XPpZAAAAYAAJ&printsec=frontcover&img=1&zoom=1&source=gbs_api,http://books.google.com/books?id=XPpZAAAAYAAJ&dq=isbn:9780394800011&hl=&cd=1&source=gbs_api
M82,THE DAY THE CRAYONS QUIT,Penguin,"When Duncan arrives at school one morning, he finds a stack of letters, one from each of his crayons, complaining about how he uses them. 75,000 first printing.",30,4.5,106,http://books.google.com/books/content?id=EC3eDAAAQBAJ&printsec=frontcover&img=1&zoom=1&edge=curl&source=gbs_api,http://books.google.com/books?id=EC3eDAAAQBAJ&printsec=frontcover&dq=isbn:9780399255373&hl=&cd=1&source=gbs_api
M78,THE DUCKLING GETS A COOKIE!?,Hyperion,Pigeon is very angry when the duckling gets a cookie just by asking politely.,40,4,258,http://books.google.com/books/content?id=Pbc5nwEACAAJ&printsec=frontcover&img=1&zoom=1&source=gbs_api,http://books.google.com/books?id=Pbc5nwEACAAJ&dq=isbn:9781423151289&hl=&cd=1&source=gbs_api
L172,THE FANTASTIC FLYING BOOKS OF MR. MORRIS LESSMORE,Simon and Schuster,"Morris Lessmore loves words, stories and books, and after a tornado carries him to another land, dreary and colorless, he finds a single book in color that leads him to an amazing library where, he learns, the books need him as much as he needs them.",56,4.5,71,http://books.google.com/books/content?id=pa4LUt0FCB0C&printsec=frontcover&img=1&zoom=1&edge=curl&source=gbs_api,http://books.google.com/books?id=pa4LUt0FCB0C&printsec=frontcover&dq=isbn:9781442457027&hl=&cd=1&source=gbs_api
L232,THE FOOT BOOK,NA,Beginner's text describes all sorts of feet doing all sorts of things.,27,4.5,36,http://books.google.com/books/content?id=OdJSSQAACAAJ&printsec=frontcover&img=1&zoom=1&source=gbs_api,http://books.google.com/books?id=OdJSSQAACAAJ&dq=isbn:9780375861352&hl=&cd=1&source=gbs_api
L247,THE GARDEN OF ABDUL GASAZI,Houghton Mifflin Harcourt,"When the dog he is caring for runs away from Alan into the forbidden garden of a retired dog-hating magician, a spell seems to be cast over the contrary dog.",33,4,29,http://books.google.com/books/content?id=Jxo26aqVMHoC&printsec=frontcover&img=1&zoom=1&edge=curl&source=gbs_api,http://books.google.com/books?id=Jxo26aqVMHoC&printsec=frontcover&dq=isbn:9780395278048&hl=&cd=1&source=gbs_api
M96,THE GARDENER,Square Fish,"By the author-and-illustrator team of the bestselling The Library Lydia Grace Finch brings a suitcase full of seeds to the big gray city, where she goes to stay with her Uncle Jim, a cantankerous baker. There she initiates a gradual transformation, bit by bit brightening the shop and bringing smiles to customers' faces with the flowers she grows. But it is in a secret place that Lydia Grace works on her masterpiece -- an ambitious rooftop garden -- which she hopes will make even Uncle Jim smile. Sarah Stewart introduces readers to an engaging and determined young heroine, whose story is told through letters written home, while David Small's illustrations beautifully evoke the Depression-era setting. The Gardener is a 1997 New York Times Book Review Notable Children's Book of the Year and a 1998 Caldecott Honor Book.",40,4,32,http://books.google.com/books/content?id=RNxtHQAACAAJ&printsec=frontcover&img=1&zoom=1&source=gbs_api,http://books.google.com/books?id=RNxtHQAACAAJ&dq=isbn:9780312367497&hl=&cd=1&source=gbs_api
M23,THE GIVING TREE,HarperCollins,"'Once there was a tree...and she loved a little boy.' So begins a story of unforgettable perception, beautifully written and illustrated by the gifted and versatile Shel Silverstein. Every day the boy would come to the tree to eat her apples, swing from her branches, or slide down her trunk...and the tree was happy. But as the boy grew older he began to want more from the tree, and the tree gave and gave and gave. This is a tender story, touched with sadness, aglow with consolation. Shel Silverstein has created a moving parable for readers of all ages that offers an affecting interpretation of the gift of giving and a serene acceptance of another's capacity to love in return. Ages 10+",64,4,4795,http://books.google.com/books/content?id=dXLWAAAAMAAJ&printsec=frontcover&img=1&zoom=1&source=gbs_api,http://books.google.com/books?id=dXLWAAAAMAAJ&pg=PP1&dq=isbn:9780060256654&hl=&cd=1&source=gbs_api
L150,THE GRUFFALO,Penguin USA,"A clever mouse uses the threat of a terrifying creature to keep from being eaten by a fox, an owl, and a snake--only to have to outwit that creature as well.",26,4.5,25,http://books.google.com/books/content?id=ZvijPwAACAAJ&printsec=frontcover&img=1&zoom=1&source=gbs_api,http://books.google.com/books?id=ZvijPwAACAAJ&dq=isbn:9780142403877&hl=&cd=1&source=gbs_api
L134,THE IMPORTANT BOOK,Harper Collins,"The important thing about The Important Book -- is that you let your child tell you what is important about the sun and the moon and the wind and the rain and a bug and a bee and a chair and a table and a pencil and a bear and a rainbow and a cat (if he wants to). For the important thing about The Important Book is that the book goes on long after it is closed.What is most important about many familiar things -- like rain and wind, apples and daisies -- is suggested in rhythmic words and vivid pictures. 'A perfect book . . . the text establishes a word game which tiny children will accept with glee.' -- K.",24,4,28,http://books.google.com/books/content?id=u-ZdUESVkp0C&printsec=frontcover&img=1&zoom=1&edge=curl&source=gbs_api,http://books.google.com/books?id=u-ZdUESVkp0C&printsec=frontcover&dq=isbn:9780064432276&hl=&cd=1&source=gbs_api
M27,THE LORAX,Random House Books for Young Readers,The Once-ler describes the results of the local pollution problem.,70,4,36,http://books.google.com/books/content?id=cJnXmrk7BxAC&printsec=frontcover&img=1&zoom=1&edge=curl&source=gbs_api,http://books.google.com/books?id=cJnXmrk7BxAC&printsec=frontcover&dq=isbn:9780394823379&hl=&cd=1&source=gbs_api
L253,THE NIGHT BEFORE MOTHER'S DAY,NA,"Hoping to shower their mother with love on Mother's Day, a family of children enlists the help of their father to bake a cake from scratch and create a luxury spa in their kitchen. Original.",32,NA,NA,http://books.google.com/books/content?id=6e1vDwAAQBAJ&printsec=frontcover&img=1&zoom=1&edge=curl&source=gbs_api,http://books.google.com/books?id=6e1vDwAAQBAJ&printsec=frontcover&dq=isbn:9780448452135&hl=&cd=1&source=gbs_api
M15,THE OTHER SIDE,Penguin,"Two girls, one white and one black, gradually get to know each other as they sit on the fence that divides their town.",32,4.5,122,http://books.google.com/books/content?id=jq_yDQAAQBAJ&printsec=frontcover&img=1&zoom=1&edge=curl&source=gbs_api,http://books.google.com/books?id=jq_yDQAAQBAJ&printsec=frontcover&dq=isbn:9780399231162&hl=&cd=1&source=gbs_api
M88,THE PAPER BAG PRINCESS,NA,"After her castle and clothes are destroyed by the dragon, Princess Elizabeth, dressed only in a paper bag, sets out to rescue Prince Ronald, who was taken captive.",27,4.5,20,http://books.google.com/books/content?id=SNWAdVofJVYC&printsec=frontcover&img=1&zoom=1&source=gbs_api,http://books.google.com/books?id=SNWAdVofJVYC&dq=isbn:9780920236161&hl=&cd=1&source=gbs_api
M50,THE PIGEON FINDS A HOT DOG!,Hyperion,Pigeon learns about sharing when a curious duckling keeps asking questions about the hot dog Pigeon has found.,40,4.5,49,http://books.google.com/books/content?id=pp6XQgAACAAJ&printsec=frontcover&img=1&zoom=1&source=gbs_api,http://books.google.com/books?id=pp6XQgAACAAJ&dq=isbn:9780786818693&hl=&cd=1&source=gbs_api
L186,THE POKY LITTLE PUPPY,Golden Books,One night a puppy who is always late coming home finds that there is no dessert for him.,24,NA,NA,http://books.google.com/books/content?id=U3xCDgAAQBAJ&printsec=frontcover&img=1&zoom=1&edge=curl&source=gbs_api,http://books.google.com/books?id=U3xCDgAAQBAJ&printsec=frontcover&dq=isbn:9780307021342&hl=&cd=1&source=gbs_api
L254,THE REAL MOTHER GOOSE,Scholastic Inc.,"Presents traditional nursery rhymes, including ""Little Jack Horner,"" ""Hot Cross Buns,"" ""The Queen of Hearts,"" and ""The Cat and the Fiddle.""",128,4.5,31,http://books.google.com/books/content?id=wLdTxADbn-UC&printsec=frontcover&img=1&zoom=1&edge=curl&source=gbs_api,http://books.google.com/books?id=wLdTxADbn-UC&printsec=frontcover&dq=isbn:9780590225175&hl=&cd=1&source=gbs_api
L222,THE STINKY CHEESE MAN AND OTHER FAIRLY STUPID TALES,Viking Books,Madcap revisions of familiar fairy tales.,50,4,99,http://books.google.com/books/content?id=ytAWAQAAMAAJ&printsec=frontcover&img=1&zoom=1&source=gbs_api,http://books.google.com/books?id=ytAWAQAAMAAJ&dq=isbn:9780670844876&hl=&cd=1&source=gbs_api
M34,THE STORY OF BABAR,Random House Books for Young Readers,"An orphaned baby elephant goes to live in the city with a kindly old lady who gives him everything he wants, but eventually he returns to the forest where he is crowned king of the elephants.",48,3,12,http://books.google.com/books/content?id=kdDfK4Xl1YAC&printsec=frontcover&img=1&zoom=1&edge=curl&source=gbs_api,http://books.google.com/books?id=kdDfK4Xl1YAC&printsec=frontcover&dq=isbn:9780394805757&hl=&cd=1&source=gbs_api
M37,THE STORY OF FERDINAND,NA,"Ferdinand likes to sit quietly and smell the flowers, but one day he gets stung by a bee and his snorting and stomping convince everyone that he is the fiercest of bulls.",32,4.5,73,http://books.google.com/books/content?id=BJgSYgEACAAJ&printsec=frontcover&img=1&zoom=1&source=gbs_api,http://books.google.com/books?id=BJgSYgEACAAJ&dq=isbn:9780448456942&hl=&cd=1&source=gbs_api
M36,THE TALE OF PETER RABBIT,Warne,"This original, authorised version has been lovingly recreated electronically for the first time, with reproductions of Potter's unmistakeable artwork optimised for use on colour devices such as the iPad. The Tale of Peter Rabbit was first published by Frederick Warne in 1902 and endures as Beatrix Potter's most popular and well-loved tale. Re-originated in 2002 to mark the centenary of publication bringing it closer to the original edition, six illustrations were restored, four that were removed in 1903 to make room for endpapers and two that have never been used before, Beatrix having initially prepared more illustrations than could be accommodated in the original format.",80,4,63,http://books.google.com/books/content?id=x1VYPnGMh0gC&printsec=frontcover&img=1&zoom=1&source=gbs_api,http://books.google.com/books?id=x1VYPnGMh0gC&dq=isbn:9780723247708&hl=&cd=1&source=gbs_api
L199,THE THREE QUESTIONS,Scholastic Inc.,"Based on a story by Leo Tolstoy. A young boy asks: When is the best time to do things? Who is the most important one? What is the right thing to do? Find out what he learns in this charming, lyrically told story",32,4,57,http://books.google.com/books/content?id=cgROlmO1f5UC&printsec=frontcover&img=1&zoom=1&edge=curl&source=gbs_api,http://books.google.com/books?id=cgROlmO1f5UC&printsec=frontcover&dq=isbn:9780439199964&hl=&cd=1&source=gbs_api
L257,THE WHEELS ON THE BUS,Dutton Juvenile,This book has movable parts which add to the fun of the story of the bus whose wheels go round and round.,14,NA,NA,http://books.google.com/books/content?id=U5KOPAAACAAJ&printsec=frontcover&img=1&zoom=1&source=gbs_api,http://books.google.com/books?id=U5KOPAAACAAJ&dq=isbn:9780525465065&hl=&cd=1&source=gbs_api
L188,THE WONDERFUL THINGS YOU WILL BE,Random House Books for Young Readers,"Illustrations and simple, rhyming text reveal a parent's musings about what a child will become, knowing that the child's kindness, cleverness, and boldness will shine through no matter what, as will the love they share.",36,4,7,http://books.google.com/books/content?id=ocvJDAAAQBAJ&printsec=frontcover&img=1&zoom=1&edge=curl&source=gbs_api,http://books.google.com/books?id=ocvJDAAAQBAJ&printsec=frontcover&dq=isbn:9780385376716&hl=&cd=1&source=gbs_api
L233,THERE'S A WOCKET IN MY POCKET!,Random House Books for Young Readers,"A household of unusual creatures includes the nupboard in the cupboard, the yeps on the steps, and the bofa on the sofa",20,4,38,http://books.google.com/books/content?id=L44KAAAACAAJ&printsec=frontcover&img=1&zoom=1&source=gbs_api,http://books.google.com/books?id=L44KAAAACAAJ&dq=isbn:9780679882831&hl=&cd=1&source=gbs_api
M61,THERE'S AN ALLIGATOR UNDER MY BED,Dial Books,"The alligator under his bed makes a boy's bedtime hazardous operation, until he lures it out of the house and into the garage.",32,4.5,16,http://books.google.com/books/content?id=nfFvDwAAQBAJ&printsec=frontcover&img=1&zoom=1&edge=curl&source=gbs_api,http://books.google.com/books?id=nfFvDwAAQBAJ&printsec=frontcover&dq=isbn:9780803703742&hl=&cd=1&source=gbs_api
M60,THIS IS NOT MY HAT,Candlewick Press,A little fish thinks he can get away with stealing a hat.,40,4,92,http://books.google.com/books/content?id=ARjDR5yFbRUC&printsec=frontcover&img=1&zoom=1&edge=curl&source=gbs_api,http://books.google.com/books?id=ARjDR5yFbRUC&printsec=frontcover&dq=isbn:9780763655990&hl=&cd=1&source=gbs_api
L197,TIKKI TIKKI TEMBO,Macmillan,An illustrated Chinese folk tale describes how the Chinese came to give all of their children short names.,42,4,69,http://books.google.com/books/content?id=YNjLTg3HmiAC&printsec=frontcover&img=1&zoom=1&edge=curl&source=gbs_api,http://books.google.com/books?id=YNjLTg3HmiAC&printsec=frontcover&dq=isbn:9780312367480&hl=&cd=1&source=gbs_api
L154,TIME FOR BED,Houghton Mifflin Harcourt,As darkness falls parents everywhere try to get their children ready for sleep.,28,4,23,http://books.google.com/books/content?id=GnPyysM69z8C&printsec=frontcover&img=1&zoom=1&edge=curl&source=gbs_api,http://books.google.com/books?id=GnPyysM69z8C&printsec=frontcover&dq=isbn:9780152010669&hl=&cd=1&source=gbs_api
M81,TRASHY TOWN,Harper Collins,"I dump it in I smash it down I drive around the trashy town Meet Mr. Gilly. He cleans up Trashy Town. He does it with a big smile and a big truck--which is sure to make him a hero with all the children in the neighborhood. David Clemesha and Andrea Zimmerman have created a rhythmic, repeatable refrain that will roll off the lips of every child. Dan Yaccarino's dynamic art puts the zip in Mr. Gilly's stride and adds style and charm to trash collection. 2000 Notable Children's Books (ALA)",32,4,12,http://books.google.com/books/content?id=19iPyW3WQuoC&printsec=frontcover&img=1&zoom=1&edge=curl&source=gbs_api,http://books.google.com/books?id=19iPyW3WQuoC&printsec=frontcover&dq=isbn:9780060271398&hl=&cd=1&source=gbs_api
L248,TUESDAY,Houghton Mifflin Harcourt,"Frogs rise on their lily pads, float through the air, and explore the nearby houses while their inhabitants sleep.",32,4,103,http://books.google.com/books/content?id=gGWvDUUi58cC&printsec=frontcover&img=1&zoom=1&edge=curl&source=gbs_api,http://books.google.com/books?id=gGWvDUUi58cC&printsec=frontcover&dq=isbn:9780395870822&hl=&cd=1&source=gbs_api
M99,WHEN DINOSAURS CAME WITH EVERYTHING,Simon and Schuster,"Although his mother is a little worried, a young boy is delighted to discover that every shop in town is giving away real dinosaurs to their customers. 75,000 first printing.",40,4,22,http://books.google.com/books/content?id=uRbBhVq040UC&printsec=frontcover&img=1&zoom=1&edge=curl&source=gbs_api,http://books.google.com/books?id=uRbBhVq040UC&printsec=frontcover&dq=isbn:9780689869228&hl=&cd=1&source=gbs_api
L218,WHERE DO DIGGERS SLEEP AT NIGHT?,Random House Books for Young Readers,"Illustrations and rhyming text reveal what trucks, tractors and construction vehicles do to get ready for bed after a hard day's work. A board book edition of a first picture book.",26,4,5,http://books.google.com/books/content?id=zs1vDwAAQBAJ&printsec=frontcover&img=1&zoom=1&edge=curl&source=gbs_api,http://books.google.com/books?id=zs1vDwAAQBAJ&printsec=frontcover&dq=isbn:9780385374156&hl=&cd=1&source=gbs_api
L168,WHERE IS THE GREEN SHEEP?,Harcourt Childrens Books,"A story about many different sheep, and one that seems to be missing. On board pages.",32,3.5,21,http://books.google.com/books/content?id=HkSKPwAACAAJ&printsec=frontcover&img=1&zoom=1&source=gbs_api,http://books.google.com/books?id=HkSKPwAACAAJ&dq=isbn:9780152067045&hl=&cd=1&source=gbs_api
M35,WHERE THE WILD THINGS ARE,Harper Collins,"Max is sent to bed without supper and imagines sailing away to the land of Wild Things,where he is made king.",48,4,4602,http://books.google.com/books/content?id=UyibVFukeDUC&printsec=frontcover&img=1&zoom=1&edge=curl&source=gbs_api,http://books.google.com/books?id=UyibVFukeDUC&printsec=frontcover&dq=isbn:9780064431781&hl=&cd=1&source=gbs_api
