book_id,title,publisher,publisher_desription,n_pages,google_mean_rating,google_num_ratings,cover_thumbnail_url,preview_url
L169,MAMA DON'T ALLOW,Turtleback,"Miles teams up with three other musicians to form the Swamp Band, in a tale inspired by an American folksong.",NA,3.5,2,http://books.google.com/books/content?id=yMkCAAAACAAJ&printsec=frontcover&img=1&zoom=1&source=gbs_api,http://books.google.com/books?id=yMkCAAAACAAJ&dq=isbn:9780808536987&hl=&cd=1&source=gbs_api
L182,ALLIGATOR PIE,HarperCollins,"A slice of Alligator Pie_Êîsized for little ones! One of the best loved Canadian poems of all time, _Ê_Alligator Pie_Êù established Dennis Lee_Ê_s reputation as _Ê_Canada_Ê_s Father Goose_Êù when it appeared in his classic poetry collection of the same name in 1974. Now Lee's timeless rhyme is paired with striking artwork by Sandy Nichols, winner of a nationwide competition to find the perfect illustrator for the iconic poem. This special 40th anniversary edition will stand up to re-readings for years to come and is a must-have for every baby and preschooler's library.",13,NA,NA,http://books.google.com/books/content?id=kArNBAAAQBAJ&printsec=frontcover&img=1&zoom=1&edge=curl&source=gbs_api,http://books.google.com/books?id=kArNBAAAQBAJ&printsec=frontcover&dq=isbn:9781443442152&hl=&cd=1&source=gbs_api
L176,BABY TOUCH AND FEEL: ANIMALS,Dk Pub,"Invites young readers to feel the textures of animals, including puppies, elephants, starfish, and snails. On board pages.",14,NA,NA,http://books.google.com/books/content?id=4eL7QwAACAAJ&printsec=frontcover&img=1&zoom=1&source=gbs_api,http://books.google.com/books?id=4eL7QwAACAAJ&dq=isbn:9780756634681&hl=&cd=1&source=gbs_api
L116,BELLY BUTTON BOOK,Workman Publishing Company,Hippopotamuses celebrate their belly buttons.,24,4.5,39,http://books.google.com/books/content?id=AEieKQEACAAJ&printsec=frontcover&img=1&zoom=1&source=gbs_api,http://books.google.com/books?id=AEieKQEACAAJ&dq=isbn:9780761166184&hl=&cd=1&source=gbs_api
L219,CARS AND TRUCKS AND THINGS THAT GO,Golden Books,On their way to the beach for a picnic the Pig family encounters almost every kind of transportation vehicle imaginable--and imaginary.,69,4.5,5,http://books.google.com/books/content?id=tmZeR-bJ53QC&printsec=frontcover&img=1&zoom=1&edge=curl&source=gbs_api,http://books.google.com/books?id=tmZeR-bJ53QC&printsec=frontcover&dq=isbn:9780307157850&hl=&cd=1&source=gbs_api
L183,CHUGGA-CHUGGA CHOO-CHOO,Hyperion,"A rhyming story about a toy freight train's day, from loading freight in the morning to retiring to the roundhouse after the day's work is done. On board pages.",32,NA,NA,http://books.google.com/books/content?id=tINTnwEACAAJ&printsec=frontcover&img=1&zoom=1&source=gbs_api,http://books.google.com/books?id=tINTnwEACAAJ&dq=isbn:9780786807604&hl=&cd=1&source=gbs_api
M31,DON'T LET THE PIGEON DRIVE THE BUS,Hyperion,"When a bus driver takes a break from his route, a very unlikely volunteer springs up to take his place-a pigeon! But you've never met one like this before. As he pleads, wheedles, and begs his way through the book, children will love being able to answer back and decide his fate. In his hilarious picture book debut, popular cartoonist Mo Willems perfectly captures a preschooler's temper tantrum.",40,4,166,http://books.google.com/books/content?id=bNsXuQEACAAJ&printsec=frontcover&img=1&zoom=1&source=gbs_api,http://books.google.com/books?id=bNsXuQEACAAJ&dq=isbn:9780786819881&hl=&cd=1&source=gbs_api
L250,ELEPHANT AND PIGGY: TODAY I WILL FLY!,Hyperion,"Gerald is careful. Piggie is not. Piggie cannot help smiling. Gerald can. Gerald worries so that Piggie does not have to. Gerald and Piggie are best friends./DIVDIV Today, I Will Fly! is the funny introduction to the characters. Piggie is determined to fly. But Gerald the elephant knows that's impossible--isn't it?",64,2,1,http://books.google.com/books/content?id=9DdeugEACAAJ&printsec=frontcover&img=1&zoom=1&source=gbs_api,http://books.google.com/books?id=9DdeugEACAAJ&dq=isbn:9781423102953&hl=&cd=1&source=gbs_api
L243,ELOISE,Simon & Schuster Children's Publishing,"Six-year-old Eloise lives with her mother and her English nanny at the Plaza Hotel, where she finds many opportunities to indulge in mischief",65,4,36,http://books.google.com/books/content?id=T3JWAAAAYAAJ&printsec=frontcover&img=1&zoom=1&source=gbs_api,http://books.google.com/books?id=T3JWAAAAYAAJ&dq=isbn:9780671223502&hl=&cd=1&source=gbs_api
L184,FROG AND TOAD,Harper Collins,"From writing letters to going swimming, telling stories to finding lost buttons, Frog and Toad are always there for each other_Êîjust as best friends should be.",64,4.5,7,http://books.google.com/books/content?id=dtyVtv8JHXwC&printsec=frontcover&img=1&zoom=1&source=gbs_api,http://books.google.com/books?id=dtyVtv8JHXwC&dq=isbn:9780064440202&hl=&cd=1&source=gbs_api
L138,FROM HEAD TO TOE,Harper Collins,"What does an elephant do? It stomps its foot. Can you? From the creator of such beloved classics as The Grouchy Ladybug and The Mixed-Up Chameleon comes this interactive story that invites kids to imitate animal movements. Watching giraffes bend their necks or monkeys wave their arms is fun, but nothing could be better than joining in. From their heads down to their toes, kids will be wriggling, jiggling, and giggling as they try to keep up with these animals!Alligators wiggle, elephants stop, gorillas thump, and giraffes bend. Can you do it? _ÊÑ I can do it!_Ê_ is the confidence-building message of this fun-filled interactive picture book. A variety of familiar animals invite young children to copy their antics, and as they play, they will learn such important skills as careful listening, focusing attention, and following instructions. Just as alphabet books introduce the very young child to letters and simple words, From Head to Toe introduces the basic body parts and simple body movements. And in the same way that children progress from understanding simple words to reading and writing sentences and stories, so they will progress from simple body movements to dancing, gymnastics, and other sports and activities, with confidence and pleasure. Eric Carle's colorful collages have delighted children for more than a generation. Each book provides hours of fun while encouraging them to stretch their imaginations. His matchless words and illustrations now send out a new challenge: Are you ready? Here we go! Move yourself From Head to Toe. A Main Selection of the Children_Ê_s Book-of-the-Month Club",28,4,49,http://books.google.com/books/content?id=cLw2UqfAeDsC&printsec=frontcover&img=1&zoom=1&edge=curl&source=gbs_api,http://books.google.com/books?id=cLw2UqfAeDsC&printsec=frontcover&dq=isbn:9780694013012&hl=&cd=1&source=gbs_api
L153,"GO, DOG. GO!",Random House Books for Young Readers,"Different kinds of dogs drive cars, wear hats, run around in mazes, and even have wild parties in treetops.",64,4,51,http://books.google.com/books/content?id=mAi8oBp2mZ8C&printsec=frontcover&img=1&zoom=1&source=gbs_api,http://books.google.com/books?id=mAi8oBp2mZ8C&dq=isbn:9780394800202&hl=&cd=1&source=gbs_api
L213,"GOODNIGHT, GOODNIGHT, CONSTRUCTION SITE",Chronicle Books,"The #1 New York Times bestseller As the sun sets behind the big construction site, all the hardworking trucks get ready to say goodnight. One by one, Crane Truck, Cement Mixer, Dump Truck, Bulldozer, and Excavator finish their work and lie down to rest_Êîso they'll be ready for another day of rough and tough construction play! With irresistible artwork by best-selling illustrator Tom Lichtenheld and sweet, rhyming text, this book will have truck lovers of all ages begging for more. Can't get enough of these tough trucks? The long-awaited sequel Mighty, Mighty, Construction Site is now available for preorder!",32,4,63,http://books.google.com/books/content?id=5ZcauwEACAAJ&printsec=frontcover&img=1&zoom=1&source=gbs_api,http://books.google.com/books?id=5ZcauwEACAAJ&dq=isbn:9780811877824&hl=&cd=1&source=gbs_api
L227,"HAPPY BIRTHDAY, BABY!",Random House Books for Young Readers,"""With Seussian stuff to touch, spin, and sniff. Based on and inspired by Dr. Seuss's Happy birthday to you!""--Cover.",10,4.5,4,http://books.google.com/books/content?id=rEE9rG1UdW4C&printsec=frontcover&img=1&zoom=1&edge=curl&source=gbs_api,http://books.google.com/books?id=rEE9rG1UdW4C&printsec=frontcover&dq=isbn:9780375846212&hl=&cd=1&source=gbs_api
L146,JAMBERRY,Harper Collins,"Hatberry Shoeberry In my canoeberry Under the bridge And over the dam Looking for berries Berries for jam They're off...a boy and an endearing, rhyme-spouting bear, who squires him through a fantastic world of berries. And their adventure comes to a razzamatazz finale under a starberry sky. Children will want to feast again and again on Bruce Degen's exuberant, colorful pictures and his rollicking, berryful rhymes. A young boy and a bear joyously romp through the land of berries where there are raspberry rabbits and a brassberry band with elephants skating on strawberry jam!Bruce Degen's exuberant tale, with his equally energetic and vibrant illustrations, is now a quality board book.",34,4.5,16,http://books.google.com/books/content?id=pJkF8-r0kzMC&printsec=frontcover&img=1&zoom=1&edge=curl&source=gbs_api,http://books.google.com/books?id=pJkF8-r0kzMC&printsec=frontcover&dq=isbn:9780694006519&hl=&cd=1&source=gbs_api
L256,LON PO PO: A RED RIDING HOOD STORY FROM CHINA,Penguin,Three sisters staying home alone are endangered by a hungry wolf who is disguised as their grandmother.,32,4.5,8,http://books.google.com/books/content?id=m-gKDAAAQBAJ&printsec=frontcover&img=1&zoom=1&edge=curl&source=gbs_api,http://books.google.com/books?id=m-gKDAAAQBAJ&printsec=frontcover&dq=isbn:9780399216190&hl=&cd=1&source=gbs_api
L103,MISS NELSON IS MISSING,Houghton Mifflin Harcourt,The arrival of a strict substitute convinces Miss Nelson's students that they must get their teacher back.,32,4,66,http://books.google.com/books/content?id=RE96I7BFGcwC&printsec=frontcover&img=1&zoom=1&edge=curl&source=gbs_api,http://books.google.com/books?id=RE96I7BFGcwC&printsec=frontcover&dq=isbn:9780395401460&hl=&cd=1&source=gbs_api
L209,"NUMBERS, COLORS, SHAPES",Macmillan,"Labeled pictures introduce words for items and concepts grouped into sections for numbers, colors, and shapes. On board pages.",26,3,1,http://books.google.com/books/content?id=P0RrAwAAQBAJ&printsec=frontcover&img=1&zoom=1&edge=curl&source=gbs_api,http://books.google.com/books?id=P0RrAwAAQBAJ&printsec=frontcover&dq=isbn:9780312510817&hl=&cd=1&source=gbs_api
L124,OH MY OH MY OH MY DINOSAURS!,Workman Publishing,Dinosaurs engage in such activities as sunbathing and creating art. On board pages with a die-cut cover.,20,4,8,http://books.google.com/books/content?id=5bdRCwAAQBAJ&printsec=frontcover&img=1&zoom=1&edge=curl&source=gbs_api,http://books.google.com/books?id=5bdRCwAAQBAJ&printsec=frontcover&dq=isbn:9781563054419&hl=&cd=1&source=gbs_api
M43,"OH, THE PLACES YOU'LL GO",Random House Books for Young Readers,"Filled with wit, wisdom and insight, Dr. Seuss humourously considers the ups and downs of life. Grades K-3 and older.",48,4.5,70,http://books.google.com/books/content?id=7vY2uQEACAAJ&printsec=frontcover&img=1&zoom=1&source=gbs_api,http://books.google.com/books?id=7vY2uQEACAAJ&dq=isbn:9780679805274&hl=&cd=1&source=gbs_api
L230,"OH, THE THINKS YOU CAN THINK!",Random House Books for Young Readers,"Back in 1957, Theodor Geisel responded to an article in Life magazine that lamented the use of boring reading primers in schools. Using the pseudonym of ""Dr. Seuss"" (Seuss was Geisel's middle name) and only two hundred twenty-three words, Geisel created a replacement for those dull primers: ""The Cat in the Hat."" The instant success of the book prompted Geisel and his wife to found Beginner Books, and Geisel wrote many popular books in this series, including ""Hop on Pop, "" ""Fox in Socks, "" and ""Green Eggs and Ham."" Other favorite titles in this series are ""Go, Dog, Go!"" and ""Are You My Mother?"" by P. D. Eastman, ""A Fly Went By, "" by Mike McClintock, and ""Put Me in the Zoo, "" by Robert Lopshire. These affordable hardcover books combine large print, easy vocabulary, and large, bright illustrations in stories kids will want to read again and again. Grades 1 - Grades 2.",41,4,23,http://books.google.com/books/content?id=C5kvSifStIIC&printsec=frontcover&img=1&zoom=1&edge=curl&source=gbs_api,http://books.google.com/books?id=C5kvSifStIIC&printsec=frontcover&dq=isbn:9780394831299&hl=&cd=1&source=gbs_api
L231,ONE FISH TWO FISH RED FISH BLUE FISH,Random House Books for Young Readers,"Illus. in full color. A ""fabulous book of easy words, exciting pictures and inviting rhythm.""--""Elementary English.",62,4,89,http://books.google.com/books/content?id=AdqjCxxY69MC&printsec=frontcover&img=1&zoom=1&edge=curl&source=gbs_api,http://books.google.com/books?id=AdqjCxxY69MC&printsec=frontcover&dq=isbn:9780394800134&hl=&cd=1&source=gbs_api
M72,PETE THE CAT: THE WHEELS ON THE BUS,HarperFestival,"Join Pete the Cat and his pals in New York Times bestselling author James Dean_Ê_s Pete the Cat: The Wheels on the Bus as they head to school in this groovy version of _Ê_The Wheels on the Bus_Êù_Êînow in board book format, perfect for little hands!",32,NA,NA,http://books.google.com/books/content?id=ConDoQEACAAJ&printsec=frontcover&img=1&zoom=1&source=gbs_api,http://books.google.com/books?id=ConDoQEACAAJ&dq=isbn:9780062358523&hl=&cd=1&source=gbs_api
L161,PUPPY BIRTHDAY TO YOU! (PAW PATROL),Golden Books,"""Based on the screenplay 'Pups turn on the lights' by Scott Albert.""",24,NA,NA,http://books.google.com/books/content?id=0BbBDAAAQBAJ&printsec=frontcover&img=1&zoom=1&edge=curl&source=gbs_api,http://books.google.com/books?id=0BbBDAAAQBAJ&printsec=frontcover&dq=isbn:9780553522778&hl=&cd=1&source=gbs_api
L141,SHE PERSISTED: 13 AMERICAN WOMEN WHO CHANGED THE WORLD,Penguin,"""A nonfiction picture book compilation of the stories of 13 American women who persisted in overcoming obstacles and changing the world""--Provided by publisher.",32,5,1,http://books.google.com/books/content?id=8EoxDwAAQBAJ&printsec=frontcover&img=1&zoom=1&edge=curl&source=gbs_api,http://books.google.com/books?id=8EoxDwAAQBAJ&printsec=frontcover&dq=isbn:9781524741723&hl=&cd=1&source=gbs_api
L149,SPAGHETTI IN A HOT DOG BUN: HAVING THE COURAGE TO BE WHO YOU ARE,Maria Dismondy Incorporated,"Even though she is teased by a boy at school for being different, Lucy has the courage to be herself and comes to the boy's aid when he is in need of help.",32,NA,NA,http://books.google.com/books/content?id=uJcNKQEACAAJ&printsec=frontcover&img=1&zoom=1&source=gbs_api,http://books.google.com/books?id=uJcNKQEACAAJ&dq=isbn:9780615473932&hl=&cd=1&source=gbs_api
L127,THE GOING TO BED BOOK,Little Simon,"Getting ready for sleep is tons of fun in this special anniversary edition of a Sandra Boynton classic. The sun has set not long ago. Now everybody goes below to take a bath in one big tub with soap all over_ÊîSCRUB SCRUB SCRUB! This classic bedtime story is just right for winding down the day as a joyful, silly group of animals scrub scrub scrub in the tub, brush and brush and brush their teeth, and finally rock and rock and rock to sleep. This anniversary edition has an enlarged trim size and metallic ink on the cover, making this Boynton classic even more special.",14,5,1,http://books.google.com/books/content?id=oe8CAAAACAAJ&printsec=frontcover&img=1&zoom=1&source=gbs_api,http://books.google.com/books?id=oe8CAAAACAAJ&dq=isbn:9780671449025&hl=&cd=1&source=gbs_api
M80,THE TRUE STORY OF THE 3 LITTLE PIGS!,Penguin,The wolf gives his own outlandish version of what really happened when he tangled with the three little pigs.,32,4.5,4,http://books.google.com/books/content?id=pIouDwAAQBAJ&printsec=frontcover&img=1&zoom=1&edge=curl&source=gbs_api,http://books.google.com/books?id=pIouDwAAQBAJ&printsec=frontcover&dq=isbn:9780140544510&hl=&cd=1&source=gbs_api
L107,"THOMAS AND FRIENDS: GO, TRAIN, GO!",Random House Books for Young Readers,Easy-to-read text tells how cautious Thomas gives a ride to a judge who is in a big hurry to get to a train show. On board pages.,24,4.5,32,http://books.google.com/books/content?id=DyjhAAAACAAJ&printsec=frontcover&img=1&zoom=1&source=gbs_api,http://books.google.com/books?id=DyjhAAAACAAJ&dq=isbn:9780375834615&hl=&cd=1&source=gbs_api
L108,THOMAS THE TANK ENGINE: THE VERY FIRST STORIES,Random House Books for Young Readers,"With the first four tales ever written about Thomas the Tank Engine and illustrated with the art from the original book, this hardcover storybook is a must-have for every Thomas & Friends fan! First published in 1946, the stories launched Thomas firmly into the hearts of countless train-loving little boys and their families, where he has remained ever since. This beautifully designed new version of timeless favorite tales makes it a classic for today, tomorrow, and always!",40,NA,NA,http://books.google.com/books/content?id=26T4oQEACAAJ&printsec=frontcover&img=1&zoom=1&source=gbs_api,http://books.google.com/books?id=26T4oQEACAAJ&dq=isbn:9780553523355&hl=&cd=1&source=gbs_api
L111,TRIANGLE (SHAPE TRILOGY),Candlewick Press,"""Meet Triangle. He is going to play a sneaky trick on his friend, Square. Or so Triangle thinks.""--Provided by publisher.",48,3,6,http://books.google.com/books/content?id=YfVMDgAAQBAJ&printsec=frontcover&img=1&zoom=1&edge=curl&source=gbs_api,http://books.google.com/books?id=YfVMDgAAQBAJ&printsec=frontcover&dq=isbn:9780763696030&hl=&cd=1&source=gbs_api
L215,WE'RE GOING ON A BEAR HUNT,NA,"This is an appealing big-format paperback version of the 1989 Smarties Book Prize winner. Beautifully written and illustrated, the favourite children's rhyme is ideal for sharing with groups of children or perfect as a bedtime story.",36,4,59,http://books.google.com/books/content?id=vCD1ngEACAAJ&printsec=frontcover&img=1&zoom=1&source=gbs_api,http://books.google.com/books?id=vCD1ngEACAAJ&dq=isbn:9781406352962&hl=&cd=1&source=gbs_api
L187,WELCOME LITTLE ONE,Sourcebooks Jabberwocky,"This interactive book celebrates the miracle of babies. Ideal for cozy laptime reading, the soothing text is paired with such engaging elements as touch-and-feels, pull-tabs, lift-the-flaps, pop-ups, and a musical sound chip. Full color.",24,NA,NA,http://books.google.com/books/content?id=nyoCswEACAAJ&printsec=frontcover&img=1&zoom=1&source=gbs_api,http://books.google.com/books?id=nyoCswEACAAJ&dq=isbn:9781492632641&hl=&cd=1&source=gbs_api
L174,WHERE IS BABY'S BELLY BUTTON,NA,"This sturdy lift-the-flap book reveals baby's belly button, feet, hands, and more to young readers. Ideal for parents to share with their children. Full color. (Baby/Preschool)",14,4,11,http://books.google.com/books/content?id=NsEBnwEACAAJ&printsec=frontcover&img=1&zoom=1&source=gbs_api,http://books.google.com/books?id=NsEBnwEACAAJ&dq=isbn:9780689835605&hl=&cd=1&source=gbs_api
L245,WHEREVER YOU ARE MY LOVE WILL FIND YOU,Feiwel & Friends,". . . I wanted you more than you'll ever know, so I sent love to follow wherever you go. . . . Love is the greatest gift we have to give our children. It's the one thing they can carry with them each and every day. If love could take shape it might look something like these heartfelt words and images from the inimitable Nancy Tillman. Here is a book to share with your loved ones, no matter how near or far, young or old, they are.",32,4.5,17,http://books.google.com/books/content?id=gzaYuQAACAAJ&printsec=frontcover&img=1&zoom=1&source=gbs_api,http://books.google.com/books?id=gzaYuQAACAAJ&dq=isbn:9781250017970&hl=&cd=1&source=gbs_api
L195,WINNIE THE POOH,Dutton Childrens Books,"Presents the adventures of Christopher Robin and his friends, in which Pooh Bear uses a balloon to get honey, Piglet meets a Heffalump, and Eeyore has a birthday.",147,4.5,97,http://books.google.com/books/content?id=Z5KkNAEACAAJ&printsec=frontcover&img=1&zoom=1&source=gbs_api,http://books.google.com/books?id=Z5KkNAEACAAJ&dq=isbn:9780525477686&hl=&cd=1&source=gbs_api
M30,A BAD CASE OF STRIPES,Scholastic,"In order to ensure her popularity, Camilla Cream always does what is expected, until the day arrives when she no longer recognizes herself.",32,4,109,http://books.google.com/books/content?id=aPn1GgAACAAJ&printsec=frontcover&img=1&zoom=1&source=gbs_api,http://books.google.com/books?id=aPn1GgAACAAJ&dq=isbn:9780439598385&hl=&cd=1&source=gbs_api
M65,A SICK DAY FOR AMOS MCGEE,Allen & Unwin,"Friends come in all shapes and sizes, and for Amos McGee, in all species too! A delightful story about friendship. Winner of the Caldecott Medal in 2011.",32,4,103,http://books.google.com/books/content?id=LzjPOea_n50C&printsec=frontcover&img=1&zoom=1&source=gbs_api,http://books.google.com/books?id=LzjPOea_n50C&dq=isbn:9781742377797&hl=&cd=1&source=gbs_api
L201,AMELIA BEDELIA,Harper Collins,"Amelia Bedelia, the housekeeper with a literal mind, merrily upsets the household when she ""dresses"" the chicken and ""trims"" the steak with ribbons and lace.",64,4,72,http://books.google.com/books/content?id=o51fpYTBLYkC&printsec=frontcover&img=1&zoom=1&edge=curl&source=gbs_api,http://books.google.com/books?id=o51fpYTBLYkC&printsec=frontcover&dq=isbn:9780064441551&hl=&cd=1&source=gbs_api
L114,ARE YOU A COW?,NA,A chicken asks who the reader is while listing different types of animals and ruling each one out as the reader's identity. On board pages.,16,NA,NA,http://books.google.com/books/content?id=NCIJngEACAAJ&printsec=frontcover&img=1&zoom=1&source=gbs_api,http://books.google.com/books?id=NCIJngEACAAJ&dq=isbn:9781442417335&hl=&cd=1&source=gbs_api
M38,ARE YOU MY MOTHER?,Random House Books for Young Readers,"Never having seen his mother, a baby bird makes humorous mistakes trying to find her.",64,4,98,http://books.google.com/books/content?id=MkTGX_O8cAUC&printsec=frontcover&img=1&zoom=1&source=gbs_api,http://books.google.com/books?id=MkTGX_O8cAUC&dq=isbn:9780394800189&hl=&cd=1&source=gbs_api
M83,ARTHUR WRITES A STORY,"Little, Brown Books for Young Readers","The class homework assignment is to write a story, and everyone seems to be writing about something interesting...except Arthur. Will he find something he cares to write about or will his story be a big mess?",32,4.5,3,http://books.google.com/books/content?id=pI2yDAEACAAJ&printsec=frontcover&img=1&zoom=1&source=gbs_api,http://books.google.com/books?id=pI2yDAEACAAJ&dq=isbn:9780316111645&hl=&cd=1&source=gbs_api
L207,B IS FOR BEAR,Macmillan,"Rhyming text introduces letters of the alphabet, pairing each letter with a textured illustration of an object, action, or concept that begins with that letter. On board pages.",26,4.5,6,http://books.google.com/books/content?id=VMPaAgAAQBAJ&printsec=frontcover&img=1&zoom=1&edge=curl&source=gbs_api,http://books.google.com/books?id=VMPaAgAAQBAJ&printsec=frontcover&dq=isbn:9780312499181&hl=&cd=1&source=gbs_api
L210,BABY BELUGA,New York : Crown Publishers,Presents the illustrated text to the song about the little white whale who swims wild and free.,32,4,9,http://books.google.com/books/content?id=DOBI2tV2BNsC&printsec=frontcover&img=1&zoom=1&edge=curl&source=gbs_api,http://books.google.com/books?id=DOBI2tV2BNsC&printsec=frontcover&dq=isbn:9780517709771&hl=&cd=1&source=gbs_api
M1,"BARK, GEORGE",Harper Collins,"""Bark, George,"" says George's mother, and George goes: ""Meow,"" which definitely isn't right, because George is a dog. And so is his mother, who repeats, ""Bark, George."" And George goes, ""Quack, quack."" What's going on with George? Find out in this hilarious new picture book from Jules Feiffer.",32,4,32,http://books.google.com/books/content?id=tqmFHagGMh0C&printsec=frontcover&img=1&zoom=1&edge=curl&source=gbs_api,http://books.google.com/books?id=tqmFHagGMh0C&printsec=frontcover&dq=isbn:9780062051851&hl=&cd=1&source=gbs_api
L252,BEAR SNORES ON,Simon and Schuster,"In a cave in the woods, in his deep, dark lair, through the long, cold winter sleeps a great brown bear.",34,4.5,38,http://books.google.com/books/content?id=RVTGAAAAQBAJ&printsec=frontcover&img=1&zoom=1&edge=curl&source=gbs_api,http://books.google.com/books?id=RVTGAAAAQBAJ&printsec=frontcover&dq=isbn:9781416902720&hl=&cd=1&source=gbs_api
M74,BEAR WANTS MORE,Simon and Schuster,"When spring comes, Bear wakes up very hungry and is treated to great food by his friends. On board pages.",34,4,24,http://books.google.com/books/content?id=rEsyBS0wFK0C&printsec=frontcover&img=1&zoom=1&edge=curl&source=gbs_api,http://books.google.com/books?id=rEsyBS0wFK0C&printsec=frontcover&dq=isbn:9781416949220&hl=&cd=1&source=gbs_api
L194,"BIG SHARK, LITTLE SHARK",Random House Books for Young Readers,Can a hungry little shark catch a big shark?,32,NA,NA,http://books.google.com/books/content?id=ZcSiDgAAQBAJ&printsec=frontcover&img=1&zoom=1&edge=curl&source=gbs_api,http://books.google.com/books?id=ZcSiDgAAQBAJ&printsec=frontcover&dq=isbn:9780399557286&hl=&cd=1&source=gbs_api
L117,"BLUE HAT, GREEN HAT",Little Simon,"Three earnest animals and one misguided turkey learn colors and clothes in this Sandra Boynton classic. Serious silliness for all ages. Artist Sandra Boynton is back and better than ever with completely redrawn versions of her multi-million selling board books. These whimsical and hilarious books, featuring nontraditional texts and her famous animal characters, have been printed on thick board pages, and are sure to educate and entertain children of all ages.",14,NA,NA,http://books.google.com/books/content?id=EpBougEACAAJ&printsec=frontcover&img=1&zoom=1&source=gbs_api,http://books.google.com/books?id=EpBougEACAAJ&dq=isbn:9780671493202&hl=&cd=1&source=gbs_api
