book_id,title,publisher,publisher_desription,n_pages,google_mean_rating,google_num_ratings,cover_thumbnail_url,preview_url
M69,OLIVIA. . . AND THE MISSING TOY,Simon and Schuster,"Olivia has one toy that she loves more than anything. She feeds him, dresses him and takes him everywhere. So when he disappears, Olivia is FURIOUS! She looks under the rug, under the sofa, under the cat. She shouts at Ian and baby William, she cries, she stomps... all to no avail. Then, one dark and stormy night, Olivia hears a noise... Clutching a candelabra, she creeps bravely into her bedroom, and sees a huge menacing shadow on the wall. Who is this monster, and what's that hanging from his jaws? All is resolved peacefully in this entertaining story starring our favourite pig and her favourite toy.",44,4,15,http://books.google.com/books/content?id=zMWpig6GfbMC&printsec=frontcover&img=1&zoom=1&edge=curl&source=gbs_api,http://books.google.com/books?id=zMWpig6GfbMC&printsec=frontcover&dq=isbn:9780857073488&hl=&cd=1&source=gbs_api
M51,DINOSAUR RESCUE,NA,"When a crew of builder dinosaurs break down on a level crossing, they know the only thing they can do to save themselves is to call Dinosaur Rescue In no time at all, help is on its way, but will the Dinosaur Rescue team get there in time to stop the train?",32,NA,NA,http://books.google.com/books/content?id=gX4WngEACAAJ&printsec=frontcover&img=1&zoom=1&source=gbs_api,http://books.google.com/books?id=gX4WngEACAAJ&dq=isbn:9780857631671&hl=&cd=1&source=gbs_api
M93,SHOW DOG,Kidz Entertainment Inc,NA,NA,NA,NA,http://books.google.com/books/content?id=isBg-nMqQuwC&printsec=frontcover&img=1&zoom=1&edge=curl&source=gbs_api,http://books.google.com/books?id=isBg-nMqQuwC&printsec=frontcover&dq=isbn:9780979504969&hl=&cd=1&source=gbs_api
L240,"KINDERGARTEN, HERE I COME!",Penguin,"Get ready for school with these fun poems! This adorable picture book celebrates all the familiar milestones and moments shared by every single kindergartener. Whether it's the first-day-of-school jitters or the hundredth-day-of-school party, every aspect of the kindergarten experience is introduced with a light and funny poem--not to mention charming illustrations.",32,4.5,2,http://books.google.com/books/content?id=3yHJpReSO6wC&printsec=frontcover&img=1&zoom=1&edge=curl&source=gbs_api,http://books.google.com/books?id=3yHJpReSO6wC&printsec=frontcover&dq=isbn:9781101642764&hl=&cd=1&source=gbs_api
M64,LADYBUG GIRL AT THE BEACH,Penguin,"It is preschooler Lulu_Ê_s first time at the beach and she needs to conquer her fear of the ocean in this hardcover picture book from the New York Times bestselling Ladybug Girl series. Lulu has never been to the beach but she knows she is going to love it_Ê_until she sees just how big and loud the ocean is. She and her dog Bingo decide that they will make sandcastles, fly kites, and get ice cream instead of swimming. But then the ocean waves snatch Lulu_Ê_s favorite pail. This is a job for Ladybug Girl! When Lulu is Ladybug Girl, she is brave and nothing can stop her from rescuing her pail _Ê_ and suddenly she is in the ocean and it is fun! This story is the perfect preparation for a first beach vacation, or to explore a new experience with a preschooler. Mama and Papa are never far away while Ladybug Girl builds up her courage and confronts something scary for the first time. For fans of Fancy Nancy and Angelina Ballerina, the Ladybug Girl series honors courage, creativity, and a love of nature!",40,3.5,9,http://books.google.com/books/content?id=1ekBkj88uyMC&printsec=frontcover&img=1&zoom=1&edge=curl&source=gbs_api,http://books.google.com/books?id=1ekBkj88uyMC&printsec=frontcover&dq=isbn:9781101654439&hl=&cd=1&source=gbs_api
L181,THE RED BALLOON,Doubleday Books for Young Readers,A small boy follows a red balloon as it drifts around Paris - sometimes just out of reach.,48,NA,NA,http://books.google.com/books/content?id=JXEIDAAAQBAJ&printsec=frontcover&img=1&zoom=1&edge=curl&source=gbs_api,http://books.google.com/books?id=JXEIDAAAQBAJ&printsec=frontcover&dq=isbn:9781101935217&hl=&cd=1&source=gbs_api
M90,ANGELINA ICE SKATES,Penguin,"Illus. in full color. To keep a couple of bullies from ruining their New Year's ice skating ballet, Angelina and her friends invite them to become part of the event. Working together, they create a celebration that is a tremendous success.",32,4,3,http://books.google.com/books/content?id=BmdFCQAAQBAJ&printsec=frontcover&img=1&zoom=1&edge=curl&source=gbs_api,http://books.google.com/books?id=BmdFCQAAQBAJ&printsec=frontcover&dq=isbn:9781101997581&hl=&cd=1&source=gbs_api
M18,MAKE WAY FOR DUCKLINGS,Penguin,Mr. and Mrs. Mallard proudly return to their home in the Boston Public Garden with their eight offspring.,68,4,75,http://books.google.com/books/content?id=e5htDQAAQBAJ&printsec=frontcover&img=1&zoom=1&edge=curl&source=gbs_api,http://books.google.com/books?id=e5htDQAAQBAJ&printsec=frontcover&dq=isbn:9781101997956&hl=&cd=1&source=gbs_api
M12,GUESS HOW MUCH I LOVE YOU,NA,"Sometimes, when you love someone very, very much, you want to find a way of describing how much you treasure them. But, as Little Nutbrown Hare and Big Nutbrown Hare discover, love is not always an easy thing to measure. Now new and exisiting fans can relive this cherished classic with this lavish edition, celebrating two decades of delighting readers since its initial creation.",32,4,41,http://books.google.com/books/content?id=HJrboQEACAAJ&printsec=frontcover&img=1&zoom=1&source=gbs_api,http://books.google.com/books?id=HJrboQEACAAJ&dq=isbn:9781406358902&hl=&cd=1&source=gbs_api
L104,GIRAFFES CAN'T DANCE,Orchard Books,"Celebrate the 20th anniversary of much-loved picture book classic, Giraffes Can't Dance, with this special new edition and a super-shiny cover! Gerald the giraffe longs to go to the great Jungle Dance, but how can he join in when he doesn't know how to tango or two-step? Everyone knows that giraffes can't dance ... or can they? A funny, touching and triumphant story about being yourself and finding your own tune, Giraffes Can't Dance has been a family favourite for 20 years. ""All toddlers should grow up reading this"" Daily Mail ""A modern classic"" Baby & Me ""A joyful read about an outsider who finds acceptance on his own terms . . . there's also a simple moral about tolerance and daring to be different"" Junior ""A fantastically funny and wonderfully colourful romp"" Daily Telegraph",32,NA,NA,http://books.google.com/books/content?id=h4vktgEACAAJ&printsec=frontcover&img=1&zoom=1&source=gbs_api,http://books.google.com/books?id=h4vktgEACAAJ&dq=isbn:9781408354414&hl=&cd=1&source=gbs_api
L148,THE POUT-POUT FISH,"Farrar, Straus and Giroux (BYR)","A NEW YORK TIMES BEST SELLER Deep in the water, Mr. Fish swims about With his fish face stuck In a permanent pout. Can his pals cheer him up? Will his pout ever end? Is there something he can learn From an unexpected friend? Swim along with the pout-pout fish as he discovers that being glum and spreading ""dreary wearies"" isn't really his destiny. Bright ocean colors and playful rhyme come together in this fun fish story that's sure to turn even the poutiest of frowns upside down.The Pout-Pout Fish is a 2009 Bank Street - Best Children's Book of the Year.",32,4,6,http://books.google.com/books/content?id=00gTAgAAQBAJ&printsec=frontcover&img=1&zoom=1&edge=curl&source=gbs_api,http://books.google.com/books?id=00gTAgAAQBAJ&printsec=frontcover&dq=isbn:9781429916332&hl=&cd=1&source=gbs_api
M98,ARNIE THE DOUGHNUT,Henry Holt and Company (BYR),"A deliciously imaginative story about friendship_Êîfrom the author / illustrator of The Scrambled States of America. Arnie was fascinated as he watched the customers stream into the bakery. One by one, doughnuts were chosen, placed in paper bags, and whisked away with their new owners. Some went by the dozen in giant boxes. ""Good-bye!"" Arnie yelled to each doughnut. ""Have a good trip!"" ""This is so exciting!"" Arnie beamed. ""I wonder who will choose ME?"" At first glance, Arnie looks like an average doughnut_Êîround, cakey, with a hole in the middle, iced and sprinkled. He was made by one of the best bakeries in town, and admittedly his sprinkles are candy-colored. Still, a doughnut is just a doughnut, right? WRONG! Not if Arnie has anything to say about it. And, for a doughnut, he sure seems to have an awful lot to say. Can Arnie change the fate of all doughnuts_Êîor at least have a hand in his own future? Well, you'll just have to read this funny story and find out for yourself. This title has Common Core connections Arnie, the Doughnut is a 2004 Bank Street - Best Children's Book of the Year.",40,3.5,6,http://books.google.com/books/content?id=zQzOXLGijlwC&printsec=frontcover&img=1&zoom=1&edge=curl&source=gbs_api,http://books.google.com/books?id=zQzOXLGijlwC&printsec=frontcover&dq=isbn:9781429940016&hl=&cd=1&source=gbs_api
L131,ARTHUR'S NOSE,Paw Prints,A young aardvark who is ashamed of his nose decides to go to the doctor to change his appearance,NA,3.5,4,http://books.google.com/books/content?id=3Er5PgAACAAJ&printsec=frontcover&img=1&zoom=1&source=gbs_api,http://books.google.com/books?id=3Er5PgAACAAJ&dq=isbn:9781442046061&hl=&cd=1&source=gbs_api
L171,LOST AND FOUND,Simon and Schuster,"As two clever boys exploit a clerical oversight, each one discovers new perspectives on selfhood, friendship, and honesty. Identical twins Ray and Jay Grayson are moving to a new town. Again. But at least they_Ê_ll have each other_Ê_s company at their new school. Except, on the first day of sixth grade, Ray stays home sick, and Jay quickly discovers a major mistake: No one knows about his brother. Ray_Ê_s not on the attendance lists and doesn_Ê_t have a locker, or even a student folder. Jay decides that this lost information could be very_Ê_useful. And fun. Maybe even a little dangerous.",192,4,24,http://books.google.com/books/content?id=SiOcAnChztoC&printsec=frontcover&img=1&zoom=1&edge=curl&source=gbs_api,http://books.google.com/books?id=SiOcAnChztoC&printsec=frontcover&dq=isbn:9781442406155&hl=&cd=1&source=gbs_api
L143,"GOOD DOG, CARL",Simon & Schuster Books For Young Readers,Lively and unusual things happen when Carl the dog is left in charge of the baby.,40,4.5,33,http://books.google.com/books/content?id=1MK7RwAACAAJ&printsec=frontcover&img=1&zoom=1&source=gbs_api,http://books.google.com/books?id=1MK7RwAACAAJ&dq=isbn:9781442416604&hl=&cd=1&source=gbs_api
M75,CHICKA CHICKA 1-2-3,Simon and Schuster,"1 told 2 and 2 told 3, ""I'll race you to the top of the apple tree."" One hundred and one numbers climb the apple tree in this bright, rollicking, joyous book for young children. As the numerals pile up and bumblebees threaten, what's the number that saves the day? (Hint: It rhymes with ""hero."") Read and count and play and laugh to learn the surprising answer.",40,4,27,http://books.google.com/books/content?id=ttVVyAdK7l4C&printsec=frontcover&img=1&zoom=1&edge=curl&source=gbs_api,http://books.google.com/books?id=ttVVyAdK7l4C&printsec=frontcover&dq=isbn:9781442424159&hl=&cd=1&source=gbs_api
M14,THE KEEPING QUILT,Simon and Schuster,"A homemade quilt ties together the lives of six generations of the author's immigrant Jewish family, remaining a symbol of their enduring love and faith.",32,4,39,http://books.google.com/books/content?id=91bjvI3jmAUC&printsec=frontcover&img=1&zoom=1&edge=curl&source=gbs_api,http://books.google.com/books?id=91bjvI3jmAUC&printsec=frontcover&dq=isbn:9781442449824&hl=&cd=1&source=gbs_api
M29,"ALEXANDER AND THE TERRIBLE, HORRIBLE, NO GOOD, VERY BAD DAY",Simon and Schuster,"He could tell it was going to be a terrible, horrible, no good, very bad day. He went to sleep with gum in his mouth and woke up with gum in his hair. When he got out of bed, he tripped over his skateboard and by mistake dropped his sweater in the sink while the water was running. He could tell it was going to be a terrible, horrible, no good, very bad day. It was a terrible, horrible, no good, very bad day. Nothing at all was right. Everything went wrong, right down to lima beans for supper and kissing on TV. What do you do on a day like that? Well, you may think about going to Australia. You may also be glad to find that some days are like that for other people too.",32,4,187,http://books.google.com/books/content?id=AGXinn6juRMC&printsec=frontcover&img=1&zoom=1&edge=curl&source=gbs_api,http://books.google.com/books?id=AGXinn6juRMC&printsec=frontcover&dq=isbn:9781442463165&hl=&cd=1&source=gbs_api
L142,TODAY I'LL BE A PRINCESS,Andrews McMeel Publishing,"Every little girl wants to be a princess, and every mom knows that the grass isn't always greener on the other side of the castle walls. With its colorful pictures, Today I'll Be a Princess will make both sides happy, encouraging hours of imaginative play. Our heroine imagines all sorts of advantages to being a princess, until she learns that princesses don't get to play in the mud. It's no contest, and the tiara is abandoned in favor of playtime outside.",12,NA,NA,http://books.google.com/books/content?id=8h0CBQAAQBAJ&printsec=frontcover&img=1&zoom=1&edge=curl&source=gbs_api,http://books.google.com/books?id=8h0CBQAAQBAJ&printsec=frontcover&dq=isbn:9781449462864&hl=&cd=1&source=gbs_api
L216,I WISH YOU MORE,Chronicle Books,"Some books are about a single wish. Some books are about three wishes. The infallible team of Amy Krouse Rosenthal and Tom Lichtenheld have combined their extraordinary talents to create this exuberant book of endless good wishes. Wishes for curiosity and wonder, for friendship and strength, laughter and peace. Whether celebrating life's joyous milestones, sharing words of encouragement, or observing the wonder of everyday moments, this sweet and uplifting book is perfect for wishers of every age. Plus, this is the fixed format version, which will look almost identical to the print version.",40,4.5,4,http://books.google.com/books/content?id=oOBwBgAAQBAJ&printsec=frontcover&img=1&zoom=1&edge=curl&source=gbs_api,http://books.google.com/books?id=oOBwBgAAQBAJ&printsec=frontcover&dq=isbn:9781452150376&hl=&cd=1&source=gbs_api
L239,BRAVE IRENE,"Farrar, Straus and Giroux (BYR)","Brave Irene is Irene Bobbin, the dressmaker's daughter. Her mother, Mrs. Bobbin, isn't feeling so well and can't possibly deliver the beautiful ball gown she's made for the duchess to wear that very evening. So plucky Irene volunteers to get the gown to the palace on time, in spite of the fierce snowstorm that's brewing-- quite an errand for a little girl. But where there's a will, there's a way, as Irene proves in the danger-fraught adventure that follows. She must defy the wiles of the wicked wind, her most formidable opponent, and overcome many obstacles before she completes her mission. Surely, this winning heroine will inspire every child to cheer her on. William Steig's Brave Irene is a 1986 New York Times Book Review Best Illustrated Book of the Year. NARRATED by MERYL STREEP.",32,3.5,18,http://books.google.com/books/content?id=bUsTAgAAQBAJ&printsec=frontcover&img=1&zoom=1&edge=curl&source=gbs_api,http://books.google.com/books?id=bUsTAgAAQBAJ&printsec=frontcover&dq=isbn:9781466808485&hl=&cd=1&source=gbs_api
L164,MVP: MOST VALUABLE PUPPY,Simon and Schuster,"From New York Times bestselling author and ESPN Television personality Mike Greenberg, host of the new morning talk show Get Up, and his wife Stacy comes a heartwarming, silly tale about a dog and her human pal. And all the authors_Ê_ proceeds from this book are going to combat pediatric cancer! Phoebe is a dog with a pink tail. She lives with her family_Êîthe Man in the Box, the Lady who Feeds Her, the Baby, and her sister the Girl with Curly Hair. Phoebe_Ê_s favorite time of day is when she and her sister go to the park and play. But today things are a different. Can Phoebe convince her best friend to try something new? And can she show her that sometimes it_Ê_s okay not to be perfect? Phoebe and her sister learn that no matter what happens and no matter how many mistakes you make, your family will always be there for you. In 2013, Mike and Stacy created the Heidi_Ê_s Angels Foundation to fund cancer research. The authors will donate their proceeds from this book to Heidi_Ê_s Angels, to help fight pediatric cancer through its support of the V Foundation for Cancer Research.",32,NA,NA,http://books.google.com/books/content?id=iGBEDwAAQBAJ&printsec=frontcover&img=1&zoom=1&edge=curl&source=gbs_api,http://books.google.com/books?id=iGBEDwAAQBAJ&printsec=frontcover&dq=isbn:9781481489324&hl=&cd=1&source=gbs_api
L151,THE GRUFFALO'S CHILD,Pan Macmillan,"""The Gruffalo said that no gruffalo shouldEver set foot in the deep dark wood.""But one wild and windy night the Gruffalo's child disobeys her father's warnings and ventures out into the snow. After all, the Big Bad Mouse doesn't really exist . . . does he?The Gruffalo's Child is the Number One best-selling, much-loved sequel to the worldwide picture-book phenomenon that is The Gruffalo. Julia Donaldson's trademark rhyming text and Axel Scheffler's brilliant, characterful illustrations combine once more to ensure that the Gruffalo's Child has followed firmly in her father's footsteps and that her story is one that children will ask for again, and again... and again! This edition features the classic story with a stunning redesigned cover and beautiful finish, making it a must-have addition to the bookshelves of all Donaldson and Scheffler fans - big and small!Also available with redesigned covers are The Gruffalo, Room on the Broom, The Snail and the Whale, The Smartest Giant in Town, Monkey Puzzle, Charlie Cook's Favourite Book, and A Squash and a Squeeze.",32,3.5,9,http://books.google.com/books/content?id=JEvFDAAAQBAJ&printsec=frontcover&img=1&zoom=1&source=gbs_api,http://books.google.com/books?id=JEvFDAAAQBAJ&dq=isbn:9781509804764&hl=&cd=1&source=gbs_api
L160,TEN LITTLE LADYBUGS,Intervisual/Piggy Toes,"In Ten Little Ladybugs, one by one, ten tactile bugs disappear. Where did they all go? Young ones will love finding this out as they feel their way through the sturdy, colorful pages of this innovative book. The cute critters provide a hands-on learning experience and the rhyming text reinforces the counting concept. Interactive, educational, adorable - this magical countdown book adds up to a whole lot of fun. See why over 800,000 have been sold to date!",22,5,12,http://books.google.com/books/content?id=dus-GgAACAAJ&printsec=frontcover&img=1&zoom=1&source=gbs_api,http://books.google.com/books?id=dus-GgAACAAJ&dq=isbn:9781581175783&hl=&cd=1&source=gbs_api
L132,BIG RED BARN,Harper Collins,"By the big red barn In the great green field, There was a pink pig Who was learning to squeal. There were horses and sheep and goats and geese -- and a jaunty old scarecrow leaning on his hoe. And they all lived together by the big red barn. In joyous and exuberant Pictures, Felicia Bond lovingly evokes Margaret Wise Brown's simple, rhythmic text about the cycle of a day on a farm, where a family of animals peacefully plays and sleeps. There were horses and sheep and goats and geese -- and a jaunty old scarecrow leaning on his hoe. And they all lived together by the big red barn. In joyous and exuberant pictures, Felicia Bond lovingly evokes Margarett Wise Brown's simple, rhythmic text about the cycle of a day on a farm, where a family of animals peacefully plays and sleeps. ""Brown's melodic text is beguiling, while its subject'the big red barn that houses a menagerie of animals and their offspring'will have instant appeal to young children. Bond's newly added drawings have a simplicity that suits the story [about the cycle of a day on a farm]. A welcome reprise."" 'BL.",32,4.5,5,http://books.google.com/books/content?id=fNydlVCw040C&printsec=frontcover&img=1&zoom=1&edge=curl&source=gbs_api,http://books.google.com/books?id=fNydlVCw040C&printsec=frontcover&dq=isbn:9780060207489&hl=&cd=1&source=gbs_api
M9,THE CARROT SEED,Harper Collins,"When a little boy plants a carrot seed, everyone tells him it won't grow. But when you are very young, there are some things that you just know, and the little boy knows that one day a carrot will come up. So he waters his seed, and pulls the weeds, and he waits ... First published in 1945 and never out of print, this timeless combination of Ruth Krauss's simple text and Crockett Johnson's eloquent illustrations creates a triumphant and deeply satisfying story for readers of all ages.",32,3.5,13,http://books.google.com/books/content?id=PFvBvtifZrwC&printsec=frontcover&img=1&zoom=1&edge=curl&source=gbs_api,http://books.google.com/books?id=PFvBvtifZrwC&printsec=frontcover&dq=isbn:9780060233501&hl=&cd=1&source=gbs_api
M28,THE RUNAWAY BUNNY,Harper Collins,"A little bunny keeps runningaway from his mother in an imaginative and imaginary game of verbal hide-and-seek; children will be profoundly comforted by this lovingly steadfast mother who finds her child every time. The Runaway Bunny, first published in 1942 and never out of print, has indeed become a classic. Generations of readers have fallen in love with the gentle magic of its reassuring words and loving pictures.",48,2.5,17,http://books.google.com/books/content?id=Kr3QSOrKoGYC&printsec=frontcover&img=1&zoom=1&edge=curl&source=gbs_api,http://books.google.com/books?id=Kr3QSOrKoGYC&printsec=frontcover&dq=isbn:9780060775827&hl=&cd=1&source=gbs_api
M45,GOODNIGHT MOON,HarperCollins,"Share this timeless classic with a new generation of readers! In a great green room, tucked away in bed, is a little bunny. ""Goodnight room, goodnight moon."" And to all the familiar things in the softly lit room_Êîto the picture of the three little bears sitting on chairs, to the clocks and his socks, to the mittens and the kittens, to everything one by one_Êîthe little bunny says goodnight. In this classic of children's literature, beloved by generations of readers and listeners, the quiet poetry of the words and the gentle, lulling illustrations combine to make a perfect book for the end of the day.",32,4,196,http://books.google.com/books/content?id=dJNoDQAAQBAJ&printsec=frontcover&img=1&zoom=1&edge=curl&source=gbs_api,http://books.google.com/books?id=dJNoDQAAQBAJ&printsec=frontcover&dq=isbn:9780062662897&hl=&cd=1&source=gbs_api
M79,THE GROUCHY LADYBUG,Harper Collins,"It's the Grouchy Ladybug's 20th birthday. To celebrate, we are introducing a new, larger format edition with brighter, more colorful pages created from Eric Carle's original artwork using the latest reproduction technology. The Grouchy Ladybug is bigger and brigher, as irascible but irresistable as ever and will surely delight new generations of readers, as well as her devoted fans of all ages. Happy Birthday, Grouchy Ladybug!",48,4,84,http://books.google.com/books/content?id=0dXL2Cysc-QC&printsec=frontcover&img=1&zoom=1&edge=curl&source=gbs_api,http://books.google.com/books?id=0dXL2Cysc-QC&printsec=frontcover&dq=isbn:9780064434508&hl=&cd=1&source=gbs_api
L241,THE MONSTER AT THE END OF THIS BOOK,NA,Grover worries about meeting the monster at the end of this book.,NA,5,2,http://books.google.com/books/content?id=rmx9tgEACAAJ&printsec=frontcover&img=1&zoom=1&source=gbs_api,http://books.google.com/books?id=rmx9tgEACAAJ&dq=isbn:9780375976506&hl=&cd=1&source=gbs_api
M26,THE LITTLE HOUSE,Houghton Mifflin Harcourt,"A country house is unhappy when the city, with all its buildings and traffic, grows up around her.",40,4,56,http://books.google.com/books/content?id=toD6rw6PpnEC&printsec=frontcover&img=1&zoom=1&edge=curl&source=gbs_api,http://books.google.com/books?id=toD6rw6PpnEC&printsec=frontcover&dq=isbn:9780395181560&hl=&cd=1&source=gbs_api
M62,THE VERY HUNGRY CATERPILLAR,NA,"Follows the progress of a hungry little caterpiller as he eats his way through a varied and very large quantity of food until, full at last, he forms a cocoon around himself and goes to sleep.",20,4,108,http://books.google.com/books/content?id=9kl_ZwEACAAJ&printsec=frontcover&img=1&zoom=1&source=gbs_api,http://books.google.com/books?id=9kl_ZwEACAAJ&dq=isbn:9780399255564&hl=&cd=1&source=gbs_api
M32,THE NAPPING HOUSE,Houghton Mifflin Harcourt,"Delightful cumulative rhyme leads up to the consequences of piling too many sleepy people and animals in a cozy bed. _Ê_Don Wood_Ê_s paintings endow Audrey_Ê_s familiar plot with beauty and newness, conveying atmosphere as well as illustrating the story._Êù--Publishers Weekly",32,4.5,24,http://books.google.com/books/content?id=onNjBwAAQBAJ&printsec=frontcover&img=1&zoom=1&edge=curl&source=gbs_api,http://books.google.com/books?id=onNjBwAAQBAJ&printsec=frontcover&dq=isbn:9780547848488&hl=&cd=1&source=gbs_api
M42,IF YOU GIVE A MOUSE A COOKIE,Scholastic Paperbacks,"If you give a mouse a cookie, he's going to ask for a glass of milk and that's only the beginning!",19,4,168,http://books.google.com/books/content?id=h-YKhhYpTzIC&printsec=frontcover&img=1&zoom=1&source=gbs_api,http://books.google.com/books?id=h-YKhhYpTzIC&dq=isbn:9780590402330&hl=&cd=1&source=gbs_api
M10,THE SNOWY DAY,Penguin,The adventures of a little boy in the city on a very snowy day. On board pages.,32,4,198,http://books.google.com/books/content?id=Hu4iDAAAQBAJ&printsec=frontcover&img=1&zoom=1&edge=curl&source=gbs_api,http://books.google.com/books?id=Hu4iDAAAQBAJ&printsec=frontcover&dq=isbn:9780670013258&hl=&cd=1&source=gbs_api
M13,HAROLD AND THE PURPLE CRAYON,Perfection Learning,"First published in 1955, this classic tells the story of young Harold, whose purple crayon and his imagination take him on wonderful adventures. Full color.",64,4,60,http://books.google.com/books/content?id=W38uPwAACAAJ&printsec=frontcover&img=1&zoom=1&source=gbs_api,http://books.google.com/books?id=W38uPwAACAAJ&dq=isbn:9780812432435&hl=&cd=1&source=gbs_api
